video_id,title,published_at,duration,view_count,like_count,comment_count
ESxXJIdA2oI,CERVEAU EN SURCHAUFFE ! (Brain Dots),2015-10-09T15:09:46Z,PT6M30S,3438930,99315,3859
qBbrnS08zmU,ULTRA HARDCORE AGARIO,2015-10-07T19:03:07Z,PT4M48S,10256505,161750,6014
_Z-nZLs2wRc,LE GÉNÉRATEUR DE WTF,2015-10-06T18:11:04Z,PT4M58S,7428333,135692,6461
Jcy3UyG9y5c,ENFIN DE LA VIRILITÉ ! (The Barber Shop),2015-10-04T16:56:55Z,PT6M15S,8336355,172634,5179
wTJEZ-DQ6oE,LE QUIZZ IDIOT,2015-10-02T17:22:37Z,PT5M22S,6068829,137383,4127
Jj7Gt-p5HqM,COMMENT ÊTRE ENCORE PLUS MALADE ? (The Unfair Platformer),2015-09-30T19:19:19Z,PT8M22S,4401618,97080,3384
9SVmMZfPlHc,QUE ÇA NE M'ARRIVE JAMAIS EN VRAI ;_; (Layers of Fear #3),2015-09-28T16:48:23Z,PT5M4S,2861512,65965,2632
sTTYGshep_8,J'AI PERDU MON CERVEAU ! (Layers of Fear #2),2015-09-27T18:25:36Z,PT7M11S,2926505,75257,2647
PA0NtggA2dE,LA MEILLEURE VIDÉO DE YOUTUBE (POUR DE VRAI),2015-09-25T17:02:14Z,PT56S,3327451,89504,2983
H4YfpqZ08Dg,PARTOUT. DES RATS PARTOUT. (Layers of Fear #1),2015-09-23T19:09:48Z,PT10M15S,3084391,83338,3520
_t4L5XbQU-M,QUI PEUT STOPPER FOUINY SQUEEZIE ?!,2015-09-22T18:57:34Z,PT7M50S,8824481,143029,7132
6XKZlsGG6LY,J'AI RENCONTRÉ JUSTIN BIEBER,2015-09-18T17:56:04Z,PT7M29S,7234480,201708,7328
1wfEHHSz6L4,LA MALÉDICTION DE SQUEEZIE.,2015-09-16T17:05:52Z,PT6M59S,3319972,87897,5262
0Fl0-9q-PBI,PRENEZ-VOUS VOTRE DOUCHE AVEC PAPA ? (Compilation),2015-09-15T17:31:56Z,PT7M11S,4752079,112082,3261
FIhlBJ9Pfc0,LA FIN D'UNTIL DAWN !,2015-09-12T17:31:23Z,PT15M48S,4202236,171128,20997
GpOSKa6UfAE,LÀ VOUS ALLEZ M'ADORER :') (Until Dawn #9),2015-09-12T16:11:19Z,PT13M4S,3592107,89727,6113
LmnujNOdhTc,NOTRE MEILLEURE VIDÉO. (Gridberd),2015-09-11T18:03:58Z,PT7M28S,3043870,80528,3147
5yeVqidRbQA,VOUS ALLEZ ME DÉTESTER... (Until Dawn #8),2015-09-11T12:40:49Z,PT19M1S,3765951,106792,12226
pdNt0RnM8AQ,QUE FAIRE SI... ?,2015-09-09T17:38:25Z,PT4M34S,9089325,264077,14195
BrZ81SDPrw0,LE VISAGE DU TUEUR... (Until Dawn #7),2015-09-08T15:40:20Z,PT15M39S,4049980,99308,6345
dEz05-xqnZw,VICTIME D'UN COMPLOT NAZI ! (Agario #6),2015-09-06T15:06:55Z,PT5M58S,9210476,182238,9284
lNsmoJLcI4A,POURSUIVI PAR UN P#TAIN D'ESPRIT ! ;_; (Until Dawn #6),2015-09-05T15:12:26Z,PT20M59S,3940446,104976,10180
iyb6loCUtcw,CHERS FANTÔMES. CORDIALEMENT. (Devilry),2015-09-04T16:50:56Z,PT5M29S,2938135,95955,2607
RFNhMcXA-r0,LE CHOIX LE PLUS HARDCORE ! (Until Dawn #5),2015-09-03T16:42:45Z,PT17M31S,4434822,114915,6913
8TZEaSKY3Cg,QU'Y A-T-IL DANS LA 1000ÈME CHAMBRE ? (Spooky's House),2015-09-02T18:59:48Z,PT8M47S,5803406,110877,4251
0cupoYjKCsw,NOUS SOMMES JUMBO. (Catlateral Damage),2015-09-01T18:12:24Z,PT5M48S,8341416,151886,4954
jF0wLTphEOo,BOUCHERIE TIME ! :'c (Until Dawn #4),2015-08-31T17:17:43Z,PT13M35S,3303581,98753,10553
QdutQZo0r7s,ÇA PART EN STEAK ! (Until Dawn #3),2015-08-29T16:14:01Z,PT19M55S,4079707,121907,10376
5ZGLYLGAdxU,VOS AMIS FERONT UNE CRISE CARDIAQUE (Dead Realm),2015-08-28T19:36:41Z,PT7M6S,6056004,114185,3289
Sk8vhvM7B_Y,IL OBSERVE AVANT D'AGIR :'( (Until Dawn #2),2015-08-27T16:34:02Z,PT20M30S,4087488,129236,8948
xxJ5f2_ELXE,LE VRAI VISAGE DE JUMBO,2015-08-26T17:08:14Z,PT4M6S,17697487,438796,21589
FqWtWv9Ee_M,VENEZ PERDRE VOTRE TEMPS.,2015-08-25T17:11:15Z,PT5M8S,10040462,227018,8354
oJqUcYSlA2E,UNTIL DAWN #1 - LA PSYCHOSE COMMENCE !,2015-08-24T15:00:03Z,PT18M15S,6124052,231856,15889
C8Azqpgqquc,L'ÉQUIPE LA MOINS PRODUCTIVE DE ROCKET LEAGUE,2015-08-21T19:41:04Z,PT9M17S,8772514,145653,5321
jo3aeNUGNnY,LE BUT DU JEU : S'ENFUIR. (My Last Friday),2015-08-20T20:05:03Z,PT7M2S,5605633,135190,7038
Aj1LAwIsLyc,DANS LES VESTIAIRES SENPAI... (Yandere Simulator #4),2015-08-18T16:38:02Z,PT5M28S,9978035,272709,8367
gOty3EuCWK8,NUDITÉ INTERDITE ! (Compilation de jeux),2015-08-16T18:26:43Z,PT7M51S,8339848,197776,10343
gouuuBZYwFc,SURVIVREZ-VOUS ?...,2015-08-07T15:39:55Z,PT2M44S,2821957,97948,12161
k3mLU7B9WZw,WORLD OF SQUEEZIE #2,2015-08-05T17:26:19Z,PT6M32S,5685054,130194,4881
wc-42j9RnTE,PINCES À LINGE CHALLENGE !,2015-08-02T18:25:23Z,PT7M,6297011,140059,7032
F0LXwtGTl3w,WORLD OF SQUEEZIE #1,2015-07-31T18:41:45Z,PT7M18S,7756216,181992,6013
lRWygv05R4Q,LE PLUS GRAND INGÉNIEUR ! (Poly Bridge),2015-07-29T17:58:24Z,PT7M40S,13720444,261962,8771
BTs7gaCMW7k,LE RETOUR DU MEILLEUR JEU \o/,2015-07-26T16:48:32Z,PT6M23S,8712121,166224,9502
rbclXLau2Cc,JE MEURS. JE DÉCÈDE. P#TAIN. (Five Nights at Freddy's 4),2015-07-24T18:25:17Z,PT10M1S,12519313,217301,22626
qM1xh3sImZs,JE SUIS CHAMPION D'EUROPE ! (Rocket League),2015-07-22T19:29:56Z,PT8M42S,9583832,193769,7566
YdsvG33gRx0,AGRESSÉ EN PLEINE VIDÉO ;_;,2015-07-19T18:26:25Z,PT7M10S,11671276,261186,17693
O9SAuUytsc8,COMMENT DÉCOMPRESSER D'UN JEU D'HORREUR ? (Timore),2015-07-17T17:23:26Z,PT7M47S,4266984,111123,4980
Chu1XqxoQio,LE DIEU DE LA LOOSE ! (Smite),2015-07-16T17:03:55Z,PT6M26S,3730602,78655,4994
J5ppOg3Ngps,LE DLC LE PLUS KAWAII ! ♥ (Trials Fusion),2015-07-13T18:27:09Z,PT7M25S,4364074,82359,4294
Y4keLE9zCTc,VOUS NE PASSEREZ PAS ! (BÉBÉ VERSION) (NIght Bli..F#CK),2015-07-12T18:24:58Z,PT7M2S,3124808,69327,2298
kwUNtnnYrMU,"DÉSOLÉ, IL N'Y A PAS DE JEU. (There is no game)",2015-07-10T18:51:02Z,PT7M17S,11059661,269867,6594
Ff90ORrYW6I,"MON NOUVEL AMOUR... (Pirates, vikings & knights II)",2015-07-08T15:28:19Z,PT5M53S,2991436,65171,3372
8QdR1mu5SHg,C'EST LA FIN.,2015-07-07T17:54:39Z,PT6M25S,12372575,378912,17407
osVvfXwmESY,CET HOMME M'A MIS EN POSITION FŒTALE.  (Boibot),2015-07-03T17:25:19Z,PT5M35S,9008526,206571,8216
6hx9zDHgi9M,JURASSIC THUG ! (ARK Survival Evolved #2),2015-07-01T19:09:30Z,PT8M8S,7453226,131941,4533
xyHXNGydf5g,ON A RENCONTRÉ  E.T. ! (All is Dust),2015-06-30T20:37:52Z,PT7M52S,3080740,81134,2943
zwF-f9RFBqY,J'AI ÉCHOUÉ... (Agario FIN),2015-06-28T19:34:33Z,PT6M55S,9181302,182155,10958
8tRzn7DeBlM,CE N'EST PAS UN MEURTRE SENPAI ! ♥ (Yandere Simulator #3),2015-06-26T18:49:35Z,PT8M24S,20016262,276214,10308
0FUMA6w76Bk,L'ANNONCE DELAMORKITUE ! \o/,2015-06-24T15:29:14Z,PT2M37S,2418007,84143,6394
NwXSjF5x6BU,PRO SNIPER MLG 720 NOSCOP. (Blockade #2),2015-06-23T15:42:00Z,PT6M42S,7405693,116849,4965
MKt6H3ihYWY,MANGER JUSQU’À L'INFINI ! (Agario #2),2015-06-21T19:17:00Z,PT6M47S,9575237,165579,10480
o1PSh7H2chg,ON VISITE MON VIEUX SKYBLOG !,2015-06-19T15:59:58Z,PT8M42S,8291977,207255,7752
hMGRCqpfFXU,NE PAS CLIGNER DES YEUX ! (Statues),2015-06-17T15:59:34Z,PT6M25S,4408347,91666,4278
WXzui57DoH0,BRÛLE FRUIT DU DÉMON ! (Fly in the house),2015-06-16T16:13:37Z,PT5M25S,2823313,65553,2241
36gzJDZdWoI,JE VEUX TOUT MANGER. (Agario),2015-06-14T16:01:43Z,PT6M16S,12962698,199912,7283
QZbND5nRs7k,4 MILLIONS D’ABONNÉS : ON S'APPELLE ?,2015-06-12T17:42:51Z,PT10M24S,5997294,224113,10398
t5b6AnIuT2o,LE MUSÉE DES ÉTRANGETÉS  ! (Compilation de jeux),2015-06-10T15:35:40Z,PT7M34S,4144426,89670,3006
TfibqdK0aEg,SURVIVRE EN MILIEU DINOSAURESQUE. (ARK Survival Evolved),2015-06-09T16:53:54Z,PT6M50S,7122891,128981,6758
TK2PP5C7CEI,JE SUIS TERRIFIÉ ! (Power Drill Massacre),2015-06-07T17:11:13Z,PT7M29S,2877919,63902,3304
qxk0CYi5fL8,COMMENT DEVENIR LAID ? (Booth),2015-06-05T15:13:44Z,PT5M17S,7290497,181497,10900
pqhmaWy2Il4,UNE VIDÉO PASSIONNANTE.,2015-06-03T19:51:22Z,PT5M31S,6324811,163705,6851
sa8qF-0Jip8,MON PANTALON APRÈS CETTE VIDÉO. (Gridberd),2015-06-02T20:23:33Z,PT7M34S,6284877,116814,4408
y5s-gonYWr0,LE MONSTRE QUI NE FAISAIT PAS PEUR ! (Erie),2015-05-31T17:08:23Z,PT7M33S,3393276,79741,2824
ZPqYPqBoZok,LA VIDÉO BAT LES STEAKS.,2015-05-29T17:34:52Z,PT6M41S,9803471,247174,16283
TxyHXInM7Hg,LE RETOUR DU STYLE ET DE LA VIRILITÉ ! (Double Action),2015-05-27T19:02:32Z,PT5M57S,3068818,61245,1709
gyYTXQRyQb8,MORTAL VICTOIRE X !,2015-05-26T16:39:01Z,PT9M,5868442,144057,8417
b4jc_-RQ9A4,VOTRE TÊTE DEVANT CE JEU.,2015-05-24T16:54:37Z,PT5M58S,8456419,212376,6367
ynVd3fUZCVc,GIRAFE SENPAI ! (Compilation de jeux),2015-05-22T17:12:44Z,PT6M51S,6723150,114541,2206
cm-oHIkblJY,MORTAL DÉFAITE X !,2015-05-20T19:28:44Z,PT7M54S,7316004,129146,3075
FItuKhcZZFk,ON A TROUVÉ MIRROR'S EDGE 2 ?! (Compilation de jeux),2015-05-19T16:57:37Z,PT6M37S,3966868,84906,1673
cK9oeM8leyw,LA JOIE DE LA CONSTRUCTION !,2015-05-17T18:02:12Z,PT7M58S,9733207,173302,3510
lFhHWid8AOI,JE KIDNAPPE POUR TOI SENPAI ! (Yandere Simulator #2),2015-05-15T17:59:49Z,PT5M31S,10237409,170886,4778
MYT6cTgzOdk,COMMENT SEREZ-VOUS DANS 20 ANS ?,2015-05-13T17:48:33Z,PT4M31S,6021891,129867,2852
819eQB5jStA,JE SUIS TERMINÉ. J'EMM#RDE CE JEU.,2015-05-12T16:58:32Z,PT7M28S,4094912,91110,2934
ElJImm7UMhE,LE MEILLEUR MOD DE GTA V !,2015-05-10T17:32:04Z,PT6M21S,19040036,310631,7472
1QAhHBF5Gx0,THIS IS GOATZ ! (Goat Simulator DLC),2015-05-08T17:50:34Z,PT7M50S,5205706,122707,2970
4R5xuEcFZr0,DROGUE SNIFF DROGUE (Compilation de jeux),2015-05-06T17:22:14Z,PT7M48S,5998861,109851,1969
mjDz5WnVcGg,LE JEU LE PLUS KAWAII ! (Pongo),2015-05-05T15:31:30Z,PT7M31S,4985812,96675,3121
TcBtqWtGeLg,PHOTOMONTAGE.exe,2015-05-01T17:44:20Z,PT4M59S,5422632,127866,3096
Yxg4CyEnoA8,JE RAGE CONTRE MOI-MÊME ! (Squeezie : le jeu),2015-04-29T19:07:55Z,PT6M44S,9001227,200932,5974
oDrC1l57fwU,JE SUIS SQUEEZIE SENSEI ! (Toribash),2015-04-28T17:12:09Z,PT7M11S,8657384,125805,3758
iY1ULhxJcT4,COMMENT (NE PAS) SOIGNER SON MAL DE GORGE ?,2015-04-26T16:45:55Z,PT4M14S,5557513,128174,6275
OIBHEBDCcfs,10 MINUTES DANS UN BUNKER HANTÉ !,2015-04-24T19:28:17Z,PT10M37S,3235477,86396,3272
dEqEygmnAWw,RENTRER CHEZ SOI BOURRÉ... (Compilation de jeux),2015-04-22T19:05:56Z,PT6M54S,5776643,108117,2437
0StqAFOxpTo,LE PROJET TITAN. (Besiege #2),2015-04-19T18:32:44Z,PT7M11S,9076126,153822,4612
sFYDUagD_2Q,UNE INCROYABLE GRENOUILLE.,2015-04-17T18:25:12Z,PT6M47S,5114712,103140,3087
FYqH4t48zoc,JE NE RAGE PAS. JAMAIS. VRAIMENT. (Give Up 2),2015-04-15T18:16:45Z,PT7M23S,5364781,100985,2733
I0NJcKac5Rs,CES CRÉATURES SONT TERRIFIANTES. (Spooky's House),2015-04-12T17:29:52Z,PT9M5S,3955268,91097,2382
-h_5dwJGm2o,BONUS : BÊTISIER QUESTION TIME 12 !,2015-04-11T16:19:09Z,PT3M1S,9426092,125616,3285
F67Wvh5yDss,4 BEAUFS EN VACANCES FINISSENT MAL... (Lakeview Cabin),2015-04-10T18:23:13Z,PT7M34S,4944174,99710,2658
aBBLYj1-oeE,TU ME VEUX SENPAI ? :$ (Compilation de jeux),2015-04-08T18:37:52Z,PT7M46S,6268601,158331,4409
KSAWbf-8nVc,STOP CHEAT MONSIEUR LE CERF (Alpages: The Five Books),2015-04-07T18:14:06Z,PT6M54S,1803137,45943,1544
w92JiKNeEsc,J'AI MON PREMIER ENFANT ! (Question Time 12),2015-04-05T18:05:41Z,PT4M47S,15056881,296202,11190
k3WRZshAFdU,CET ENFANT VA VOUS FAIRE CRAQUER. (Happy Wheels),2015-04-03T18:05:17Z,PT6M35S,8854337,147028,3171
sfmNaqaVg-8,L'ULTIME REMÈDE CAPILLAIRE ! (Hair Try On),2015-04-01T17:40:12Z,PT4M46S,3619593,82647,2499
7xi_bmxBxK0,"IL PREND LE TRAIN, PUIS... (The Train)",2015-03-31T19:14:07Z,PT9M9S,2978182,69508,2142
u_3nsMgZhnk,JE BRÛLE DE RAGE ! (Compilation de jeux),2015-03-29T18:25:04Z,PT6M55S,6672777,117233,3150
vlMhQ9nzFQM,JE PASSE AU DÉTECTEUR DE MENSONGE (ÉLECTRIQUE),2015-03-27T19:06:01Z,PT5M53S,12753662,274141,9294
X5vHDu4XRWw,MOI TOUT RATER MOI TOUT CASSER ! (Medieval Engineers),2015-03-25T18:36:22Z,PT6M44S,4707095,106152,1644
6bPYQUBMhfI,LE COURS D’ÉDUCATION SEXUELLE. (Compilation de jeux),2015-03-24T18:51:14Z,PT8M4S,5117386,82839,3201
OFasPYWS7dE,SIMULATEUR DE COMBAT ALCOOLISÉ ! (Kuja),2015-03-22T18:38:52Z,PT5M56S,3889351,62465,1794
tM7gZT5aNhs,JE REGRETTE PROFONDÉMENT. (Tabasco Challenge),2015-03-20T18:16:29Z,PT7M41S,6597926,123263,5433
oPX4vAPgL6o,ESCALIERS ! (DAT TITRE) - Stairs,2015-03-18T18:22:00Z,PT7M29S,2229485,53412,1860
dDb1oXh1o4g,10 MINUTES DE SOUFFRANCE. (The Impossible Quiz),2015-03-17T16:33:45Z,PT10M29S,9101738,155844,4327
uSSNT7-X428,LE DUEL ÉLECTRIQUE !,2015-03-15T18:07:40Z,PT6M27S,9588285,207455,7288
A3k4bV4OncQ,LE SECRET DE JUMBO... (Evie #2),2015-03-13T18:04:07Z,PT5M28S,10358052,195328,6036
KlEMvbIR_cg,MEILLEUR SELFIE DU MONDE 10/10 (DreadOut #2),2015-03-11T17:47:19Z,PT7M47S,1935522,45707,1542
Aytq7eDYauk,MES DESSINS PRENNENT VIE ! :') (Draw a Stickman: EPIC),2015-03-10T17:26:01Z,PT7M36S,4036727,84542,2886
BdcNPlzvtgU,APPELEZ-MOI ZIE... SQUEEZIE (Five Nights at Freddy's 3 FIN),2015-03-08T18:22:31Z,PT6M36S,5440202,168902,8907
6faeA6aq-RQ,DÉFINITION DU TRY HARD. (10 Second Ninja),2015-03-06T18:31:18Z,PT7M18S,5846385,112659,4048
1ryovNbc87Q,JOYEUX ANNIVERSAIRE TOUT L'MONDE ! (4 ans),2015-03-04T18:31:11Z,PT7M47S,5201885,188542,15863
cZEJYc_3zao,Five Nights at Freddy's 3 : SURPASSONS-NOUS !,2015-03-03T18:29:44Z,PT9M15S,6550804,126402,12544
kgCHf5uTx6U,"CONSTRUIRE, DÉTRUIRE, JOUIR. (Robocraft)",2015-03-01T18:25:53Z,PT7M11S,6545254,106187,4056
bnQWnuhPib8,MEILLEURE CINÉMATIQUE D'UN JEU 10/10 (DreadOut),2015-02-27T16:48:48Z,PT8M8S,2320317,54595,2080
sDExdYefmBE,UN AMOUR IMPOSSIBLE... (Stranded Deep),2015-02-25T17:01:09Z,PT6M19S,6269341,107682,3708
pLSCuQ_8lKo,BIENVENUE À BORD B#TCH ! (The Ship),2015-02-24T17:46:16Z,PT6M56S,5616603,75676,2260
na5SIr5VNrk,MA PASSION SECRÈTE... (Bridge Constructor),2015-02-22T19:05:26Z,PT7M8S,11245088,169355,4350
rIMtx7U2USk,DESSINONS DES STARS !,2015-02-20T18:51:46Z,PT5M3S,8720428,200346,12375
E_PLT-QaoMQ,FIVE NIGHTS AT FREDDY'S : WTF ÉDITION,2015-02-18T18:28:28Z,PT7M16S,5570651,94389,4638
28kmQRnuWtM,LA FAIBLESSE DE L'HOMME... (Compilation de jeux),2015-02-17T18:14:21Z,PT6M7S,5845426,106444,3656
R0gqOjA1u1Y,QUAND SCOTT SE FÂCHE TRÈS FORT ! (Monstrum),2015-02-15T18:29:08Z,PT7M10S,2581376,52767,2581
8kjlWlAzIUg,POUVONS-NOUS SORTIR AVEC ELLE ? (Saint-Valentin),2015-02-13T19:54:39Z,PT8M12S,12225627,188528,6405
wfwlS8GfMKY,LE PLUS ÉTRANGE DES JEUX TABLETTE. (Compilation),2015-02-11T18:33:32Z,PT7M26S,7065388,108632,4159
7Naikrsmo-w,IL FAIT SON COMEBACK ! (Garry's Mod),2015-02-10T18:16:49Z,PT7M32S,4863718,75404,2581
iuBHONhiuII,ÇA VOUS DIT DE TOUT FAIRE PÉTER ? (Besiege),2015-02-08T18:01:49Z,PT8M21S,8144303,149570,5618
oaYvSFXMa80,HATERS GONNA NUS ! (First Person Lover),2015-02-06T18:26:31Z,PT7M22S,3171288,68994,2869
yM4Hepci-yE,COMMENT (NE PAS) SÉDUIRE CETTE FEMME ?,2015-02-04T18:30:03Z,PT5M20S,10918407,218925,10933
2tdu6kim_RU,SPEEDRUNNERS: BORDEL ÉDITION,2015-02-03T18:25:03Z,PT6M50S,2305364,50017,2044
6djASMi2B8k,LES VILAINS COMMENTAIRES...,2015-02-01T18:48:07Z,PT6M17S,12335622,370661,54976
ZcWLesWr4x0,PLUS DE TÊTE ? AUCUN PROBLÈME ! (Chivalry),2015-01-30T15:52:19Z,PT6M32S,2669371,47318,1967
8epK-g9Ofvc,"DES CRABES, DES CRABES PARTOUT ! (Stranded Deep)",2015-01-28T15:34:03Z,PT5M38S,4862380,88289,3154
gYGm3w1Z4Js,COMMENT NE PAS SURVIVRE DANS UN SURVIVAL ?,2015-01-27T17:42:59Z,PT9M6S,3623537,58158,3416
Jfuxk1wmbuU,PRO JEU D'HORREUR ! (Stowaway),2015-01-25T17:00:42Z,PT7M56S,2157719,49097,2616
Nq4EUIMs4IY,L'ATTAQUE DES TITANS !,2015-01-23T18:55:58Z,PT6M30S,6055409,117030,7870
SGvuRsCogVM,QUEL EST LE F#CK ?! (Compilation de jeux),2015-01-21T18:00:52Z,PT4M48S,3537656,64543,2488
DBbjLrqMgMo,SQUEEZIE RENDU FOU PAR UN JEU. (Wooden Floor),2015-01-20T19:33:56Z,PT7M52S,3632843,71869,3930
_qE7hParoT8,JAKE : L'ENFANT ARROGANT (Happy Wheels),2015-01-18T19:02:49Z,PT7M37S,11443808,156232,4107
tD_qHYRbtfU,LE JEU QUI TESTE TA PATIENCE !,2015-01-16T18:02:26Z,PT6M53S,7041005,135765,5561
7A0zMiiRMyk,THIEF TOWN !,2015-01-14T18:14:47Z,PT7M19S,2333528,53412,2835
HISKjj1egIc,BLAGUE TERRIFIANTE POUR YOUTUBER..! (Compilation de jeux tablettes),2015-01-13T17:00:13Z,PT8M12S,10329520,150106,6105
2wCLB_mCsBI,LA BATAILLE LA PLUS ÉPIQUE ! (Grimoire: Manastorm),2015-01-11T17:00:14Z,PT5M29S,2607237,56091,2149
eEijHOLEODw,90 SECONDES POUR DESSINER (MAL) !,2015-01-09T18:04:21Z,PT5M46S,4693331,82527,2865
h2wYOdDgDeE,BUGBUGBUGBUGBUG (Haunted Memories),2015-01-07T18:57:56Z,PT8M40S,2368624,84692,8911
cfAT9kf-Y-o,TRICHER POUR GAGNER ! (ScreenCheat),2015-01-06T17:36:19Z,PT9M1S,4840634,79581,2397
pQ9ExxEtPyo,CE JEU PEUT VOIR VOTRE AVENIR... (Compilation de jeux),2015-01-04T18:24:35Z,PT8M33S,6880034,117027,3179
t2Dzww9_vxI,JUMBO VS POLICE (Turbo Dismount),2015-01-02T18:06:26Z,PT7M30S,8939214,130388,4175
NKOmkiCxklE,NOUVEL AN DANS UNE MAISON HANTÉE... (Paranormal),2014-12-31T17:36:11Z,PT9M29S,3364798,71691,4017
Wd0ODGKEPhU,"NAZIS, CRAIGNEZ-NOUS ! (Super Wolfenstein HD)",2014-12-30T17:33:36Z,PT6M50S,3665750,67404,2827
M0K9Akpt0Gg,MON CADEAU DE NOËL POUR VOUS !,2014-12-29T16:29:19Z,PT3M36S,2670495,73907,5317
_15Fuql4VAI,L’ACHÈVEMENT DE TOUTE UNE VIE !,2014-12-28T18:32:52Z,PT7M15S,5879649,123692,3359
GFcxPQKHgyU,COMPILATION DE JEUX DE QUALITÉ,2014-12-26T17:42:58Z,PT7M46S,7211463,110817,2955
7eOsdIfW1VE,QUE FAIRE LE SOIR DE NOËL ? (The Very Organized Thief),2014-12-24T16:32:17Z,PT7M11S,4779964,81717,2685
R91MsvP5LLo,BÉBÉ SQUEEZIE EST DE RETOUR ! (Among The Sleep DLC),2014-12-23T18:57:49Z,PT8M31S,3309167,62230,2365
pXD9QWO4SGs,QUAND MINECRAFT RENCONTRE COUNTER-STRIKE !,2014-12-21T17:30:44Z,PT7M42S,7672605,125060,5379
drLlXOZbXuE,JE SUIS DEVENU UN MONSTRE !,2014-12-19T19:29:48Z,PT3M34S,10880301,194536,7229
lC0cb7XwNTY,COMMENT SE FAIRE DES AMIS ? (Road Redemption #3),2014-12-17T18:04:50Z,PT6M46S,3795037,65639,2227
CayXNc03dM0,"NON, JE NE RAGERAI PAS. (Wizard Wizard)",2014-12-16T18:31:08Z,PT8M21S,3375299,65810,2107
JdC_cQZjbfc,SHREK MADNESS !,2014-12-14T18:27:25Z,PT5M22S,2101044,54270,1804
Ku4__zuIzsg,SAVEZ-VOUS DANSER ? MOI NON.,2014-12-13T17:35:46Z,PT7M40S,5143432,111481,9436
JmfKnVgwbOs,SLAPMAN : LE NOUVEAU SUPER-HÉROS ! (Compilation de jeux),2014-12-12T17:22:01Z,PT7M51S,5001893,82544,2726
lWIDDOZzpCQ,STARWHAL !,2014-12-10T17:16:36Z,PT10M14S,5180254,72074,2085
YarMkkRc39Q,MEILLEUR POLICIER DU MOND...RAGERAGE (Deputy Dangle),2014-12-09T17:42:19Z,PT7M40S,5120227,76628,1771
fFqXbRzZsGQ,SIMULATEUR D'ACHATS DE NOËL,2014-12-07T18:19:08Z,PT7M27S,5276960,90360,2703
grx5qsPrbkk,LA TARTINE QUI TE TEND ! (I am Bread),2014-12-05T17:39:31Z,PT7M36S,5770925,96364,3506
RSEflJXeTYw,SQUEEZIE VS ABONNÉS (#1?),2014-12-03T18:39:34Z,PT6M54S,3682141,76976,4728
Cyw4vjaGmFE,QUAND LES TRAINS NE BLAGUENT PAS. (Compilation de jeux),2014-12-02T18:31:07Z,PT7M,7316757,126258,4542
kEen5TK_R4s,MERCI,2014-12-01T18:28:25Z,PT7M40S,1829410,154504,18814
em5cpFv05aE,UN VOYAGE DANS LE TEMPS?!,2014-11-30T17:57:29Z,PT8M37S,7963852,165695,8114
ztk7z-JIOL0,LE JEU LE PLUS BADASS ! (Muddy Heights & PTTR),2014-11-28T17:03:23Z,PT7M3S,8469920,126618,2805
l2sn9UjPtfc,LE NIVEAU SECRET DES VACHES ! (Goat MMO #2),2014-11-26T16:09:43Z,PT7M4S,3190039,57185,3612
uDjAJ8tw178,SUPER SMASH BRAWLHALLA !,2014-11-25T18:30:24Z,PT11M11S,4255722,67945,3085
d82b3Kerleo,COMMENT ÊTRE KIM KARDASHIAN ?,2014-11-23T17:27:49Z,PT5M,14386511,275674,13879
DiRwl-CIVAs,GOA... MICRO-ONDES SIMULATOR ?! (Goat MMO #1),2014-11-21T17:54:06Z,PT8M39S,3110474,57801,1921
ldwjQVlKTVg,ALIEN FRENCH KISS (Alien: Isolation Oculus),2014-11-19T18:02:00Z,PT8M19S,2321786,46597,1829
1HxUB80ybYc,DÉFINITION DE L'HOMME NON DOUÉ. (GTA V PS4),2014-11-18T18:47:43Z,PT8M54S,9341266,133344,4712
3VWXU9ZbhG4,DUNGEON NIGHTMARES 2,2014-11-16T17:00:12Z,PT8M7S,1653928,46722,2452
RoPfPoV3uyk,SAVEZ-VOUS FAIRE 2 CHOSES À LA FOIS ? (Compilation de jeux),2014-11-14T17:59:17Z,PT7M55S,5929113,90662,3174
82CWR9BRAlU,THE FOREST COOP,2014-11-12T17:59:38Z,PT8M12S,3759594,63664,2932
oAm7DpUAYJY,C'EST TROP POUR MOI. (Five Nights at Freddy's 2),2014-11-11T17:31:01Z,PT8M40S,8362520,150840,17230
cVgWHy5qzxQ,L’ÉPREUVE FINALE.,2014-11-09T17:30:51Z,PT6M47S,7512322,175655,38162
rWHSwXaeZPM,LE FILS CACHÉ DE TOM CRUISE ! (Lullaby),2014-11-07T18:37:41Z,PT6M29S,2666963,52135,2295
zbpcAaeys1s,PLEURER DE RAGE... (The Impossible Game),2014-11-05T17:41:36Z,PT8M14S,4814742,83745,6950
giyZAaMbBIA,QUE SE CACHAIT-IL DANS LES TRANCHÉES ? (1916),2014-11-04T18:31:37Z,PT7M5S,3143271,61288,3085
6l8lobKhHBo,IL CAMBRIOLE LA MAUVAISE MAISON...,2014-11-02T18:58:28Z,PT7M40S,5298509,81893,3365
EG-83Cgnqoo,PILOTE OU PAS PILOTE ? (Air Brawl),2014-10-31T19:39:22Z,PT6M23S,3162626,62967,3030
Z4y3IWzEMQE,COUPER DES FRUITS TU FERAS ! (Compilation de jeux),2014-10-29T17:18:08Z,PT6M55S,5161183,82460,3050
DCOxtK4eiAA,SOCCER PHYSICS !,2014-10-28T17:00:14Z,PT7M38S,6672605,99667,4794
1YEPCuUhjUU,ANIMALS GONNA HATE ! (Far Cry 4),2014-10-26T18:01:42Z,PT9M11S,6970138,95424,5148
beCf9SaGce4,LA FIN D'ALIEN ISOLATION...,2014-10-25T15:55:45Z,PT15M53S,3366319,156982,8353
U4bEprFhZa8,COIFFONS DES YOUTUBERS!,2014-10-24T19:39:39Z,PT6M56S,5750474,110985,7700
2IsWH5CiCq4,ILS ONT DES ENFANTS... DES AFFREUX ENFANTS. - Alien: Isolation gameplay FR - #10,2014-10-23T16:29:39Z,PT14M51S,2004490,49414,2857
S0hLm-ldPFI,L'INCROYABLE OPÉRATION D'OCTODAD !,2014-10-22T15:30:06Z,PT7M32S,5546889,81653,2809
F_JYcZ0FSeY,HUMAINS VS REQUINS!,2014-10-21T18:14:19Z,PT9M28S,4865078,72108,2562
O3vXp3cjs4E,NU COMME UN VER ;_; - Alien: Isolation gameplay FR - #9,2014-10-20T19:03:22Z,PT10M41S,2082567,47701,2145
152NcXaiJCg,"CET HOMME EST JOSEPH, IL EST DANGEREUX. (The Evil Within)",2014-10-19T17:32:51Z,PT8M50S,3003162,54578,2176
Bm85gU6UvXo,"DES ANDROÏDES, DES ANDROÏDES PARTOUT ! - Alien: Isolation gameplay FR - #8",2014-10-18T19:41:13Z,PT14M8S,2008203,48181,1939
OYlmmjsuiZw,JE VEUX RENTRER À MA MAISON ! - Alien: Isolation gameplay FR - #7,2014-10-17T15:09:24Z,PT15M45S,1992378,53654,1729
c1m2lzcrUek,L'INCROYABLE RENCARD D'OCTODAD !,2014-10-15T16:54:13Z,PT8M16S,4951705,84383,2529
1CLcfMD05fM,J'AI PASSÉ UNE NUIT MOUVEMENTÉE. (The Forest #8),2014-10-14T17:20:14Z,PT8M21S,3601236,66855,2388
2aqubQYfsJM,J’ÉTAIS SUR L'ORDI QUAND SOUDAINEMENT... - Alien: Isolation gameplay FR - #6,2014-10-13T18:09:32Z,PT13M32S,2412904,54321,2642
Ey9QmuJ0MP0,LA VÉRITÉ SUR HARRY POTTER !,2014-10-12T18:23:11Z,PT4M55S,14085128,334635,15900
5Mv0ZAK9S64,BIENVENUE À ANDROIDLAND ! - Alien: Isolation gameplay FR - #5,2014-10-11T18:24:19Z,PT14M46S,2318307,52057,2934
sqIWbiLA_qk,CECI EST L'ANARCHIE ! (Road Redemption #2),2014-10-10T16:31:02Z,PT6M56S,4465070,71961,2201
jxbFBvQPyqw,RENCONTRE AVEC L'ALIEN... - Alien: Isolation gameplay FR - #4,2014-10-09T17:39:42Z,PT12M34S,2353902,57221,2154
42e11WB28hw,JE N'ÉTAIS PAS PRÊT À Y JOUER.,2014-10-08T17:45:51Z,PT11M52S,8744844,129742,7895
On5ZdOaMQV8,BESOIN D'UN PIEU ? ON ARRIVE ! - Chivalry: Medieval Warfare,2014-10-07T17:40:16Z,PT9M14S,6369731,90850,3455
faZMwKk3YJg,NOTRE PREMIER CHAGRIN D'AMOUR ;_; - Alien: Isolation gameplay FR - #3,2014-10-06T16:44:25Z,PT10M51S,2646495,74464,2512
PgdOd4QZhuE,CHOQUANT : IL SE FAIT TRAQUER PAR UN SNIPER... (Hunted & Windlands),2014-10-05T19:28:20Z,PT9M49S,4378711,81162,2035
gfCRkwncEEQ,"PIERRE, NOTRE PREMIER AMI... DÉCÉDÉ - Alien: Isolation gameplay FR - #2",2014-10-04T16:00:12Z,PT9M30S,2480979,51638,2615
xiEGN8ieVDM,ON EMBARQUE POUR ALIEN ISOLATION !,2014-10-03T16:26:23Z,PT10M1S,3399911,75050,4020
hMwottj-Grg,BOTTER DES C*LS AVEC STYLE ! - Double Action: Boogaloo,2014-10-01T17:23:36Z,PT9M15S,4763034,74304,3051
Mjdh2j_Qg-8,BESOIN D'UN NETTOYAGE DE VENTRE ? - Phantasmal,2014-09-30T17:49:31Z,PT6M54S,2422230,42089,2011
bMWKqj-lp6I,ÇA FAIT QUOI D’ÊTRE UN CHAT ? - Purrkour,2014-09-28T17:36:51Z,PT8M1S,7543326,112895,5260
Vu9IO8Y_LmE,DOUBLE RAT BURGER ! - Citizen Burger Disorder,2014-09-26T20:52:27Z,PT7M22S,5882993,85748,3223
r7vt8mhH0TI,UNE NOUVELLE CHIRURGIE RÉVOLUTIONNAIRE !,2014-09-24T18:52:31Z,PT4M32S,15382086,291515,17971
eB0yTQ_DMx8,"PLUS RARE QUE LE DIAMANT, LES... (The Midnight Game)",2014-09-23T18:14:52Z,PT8M37S,2507650,76270,2153
GGU6uhXH3qA,CE JOUR EST ENFIN ARRIVÉ ! (Sonic Unfair),2014-09-21T17:42:40Z,PT8M52S,4462989,71479,3561
1iSaCbxghX8,IL N'Y A PAS PLUS SEXY SUR TERRE ! - Doorways: The Underworld,2014-09-19T18:08:43Z,PT9M43S,4219557,61037,2748
Y9a3auVgK-Y,NE PAS TOUCHER MON RATON LAVEUR ! - The Forest (7),2014-09-17T16:47:58Z,PT7M5S,3556521,67640,2993
oa9m51_FTkQ,LA DANSE DE L'HOMME REQUIN ! - Speedrunners,2014-09-16T19:20:31Z,PT8M35S,3936955,54625,1684
rhIeMylewRs,MANGER DES VOITURES GRATUITEMENT ! - Road Redemption,2014-09-14T17:02:29Z,PT7M2S,6028346,96729,3511
KbKNHlKjlJw,TRANSFORMONS-NOUS EN HOMME VIRIL ! - Chivalry: Deadliest Warrior,2014-09-12T18:05:04Z,PT8M15S,3408879,59837,2031
_JQV2OqmI4A,C'EST L'HEURE DE LA REVANCHE ! (Draw Something),2014-09-10T17:49:48Z,PT8M5S,8163101,152277,5817
8_9aoEl0Rpc,UN BRUIT = LE DÉCÈS ! - Lurking,2014-09-09T16:42:00Z,PT8M42S,3326954,71137,2573
L214dlYBEas,LORD BURGOR ! (FaceRig),2014-09-07T18:12:31Z,PT6M55S,7472437,140272,5758
__mMp0CXRFw,ILS SONT VOTRE PIRE CAUCHEMAR ! - Dark Deception,2014-09-05T16:00:10Z,PT6M6S,2210825,43981,1802
qztM1vEl4xM,ÉLU PIRE JOUEUR DE GEOMETRY DASH.,2014-09-03T17:21:12Z,PT7M43S,8073706,137524,20246
rg9cdQNdqQw,EXTREME FOOTBALL ! (Garry's Mod),2014-09-02T18:39:50Z,PT5M32S,5149310,77902,2646
Ne87QAqUGW4,LE ICE BAGUETTE CHALLENGE ?! - Question Time 11,2014-08-31T16:01:52Z,PT4M12S,15475167,233559,12537
tBwX67hFycE,TOUJOURS SE MÉFIER D'UNE PETITE FILLE ! - Lost In The Rift,2014-08-29T18:44:05Z,PT7M41S,2273023,49546,3221
3t65DnCqUVo,J'OUVRE MON SALON DE COIFFURE ! (Toca Hair Salon Me),2014-08-27T18:15:18Z,PT7M31S,6313100,112088,12165
aK8MV16YGVo,UNE ÉQUIPE TALENTUEUSE SUR JUST CAUSE ! (titre non contractuel),2014-08-26T16:01:01Z,PT8M24S,6028572,124313,6584
YE1mfWlmWxg,LE MEILLEUR MONTAGE PHOTOSHOP !,2014-08-24T19:05:43Z,PT7M43S,12903762,275740,10548
UC3p1WD5PCg,THE ZOO RACE !,2014-08-22T18:02:59Z,PT7M27S,2843948,55872,2631
xnDuOKrJzYU,QUAND L'ACCIDENT EST PARTOUT ! - Next Car Game,2014-08-20T17:36:47Z,PT7M22S,8664132,154697,6238
li_H1jIqVZ0,QU'Y A-T-IL DE PIRE QU'UN CRI D'ENFANT ? - Affected,2014-08-19T16:40:13Z,PT9M28S,2433384,57420,4616
TP_JspSdVuU,UNE AVENTURE NORMALE ! (Normal Adventure),2014-08-17T17:49:21Z,PT10M10S,4255085,69805,1918
7r7doddh9Cc,VOUS VOULEZ ÊTRE OPPRESSÉS ? CLIQUEZ. (Five Nights at Freddy's),2014-08-15T17:55:39Z,PT10M54S,14708883,222434,22107
QmeDqbWqAeI,ENTREZ DANS MA GROTTE... (Setup),2014-08-13T16:00:14Z,PT6M14S,4254072,132071,7996
Ch92TkRX0mU,POLICIERS VS VOLEURS ! (Garry's Mod),2014-08-12T16:00:35Z,PT8M57S,10205972,131226,5432
qS9wpddroLs,BIENVENUE DANS LA MATRICE ! - The Forest (6),2014-08-10T16:57:09Z,PT8M38S,3910329,71228,5481
Wt9K3osWMGE,AVEZ-VOUS DÉJÀ OPÉRÉ UN CERVEAU ? - The Evil Within Gameplay FR (E3 Demo),2014-08-08T15:59:24Z,PT13M37S,3296211,60031,3634
BFCXWvyw-1k,LA TACTILITÉ À SON SOMMET  ! (Mount Your Friends),2014-08-06T17:46:56Z,PT8M1S,4720733,97275,3183
