video_id,title,published_at,duration,view_count,like_count,comment_count
9IEy2aMb1mU,J’essaie l’origami et c’est l’enfer,2019-07-27T17:14:50Z,PT15M9S,8589785,419592,18692
5Y70u4zGtJU,Est-ce vraiment ce que vous voulez ?,2019-07-22T15:09:57Z,PT11M7S,13732205,620870,27098
HKgwU93u9Vo,Réponse à vos questions (enfin pas toutes car y'en a vraiment beaucoup mais pas mal quand même),2019-07-17T16:44:10Z,PT12M13S,5746871,409695,30784
8A9YDTKiwo4,Ces images m'ont fait mal au crâne mais je vais bien,2019-07-12T16:35:30Z,PT10M26S,15386806,582662,13537
VyM776m9GsQ,Une nouvelle histoire qui fait bien peur (courage),2019-07-07T17:00:02Z,PT14M1S,14574044,637979,39164
jFJyCgNU0T8,YOKO - Collection 'Basic' et 'Yokai',2019-07-03T16:00:21Z,PT2M,3577892,266907,23204
E9AuAVfEAnw,Arrêtez de m’offrir ça j'y arrive pas,2019-07-01T17:00:13Z,PT16M55S,15860097,635232,18715
80H0fnT8sZs,Je déterre mes vieux tweets (c’est gênant mais touchant),2019-06-26T16:57:20Z,PT11M49S,9458636,553131,13714
pfTGWKbPIvE,J'ai découvert ce bouton et ça a tout changé (ok j'exagère un peu),2019-06-21T16:31:13Z,PT10M52S,11691967,651932,15276
0blw7r3IPjw,Ça commence mal mais ça finit bien...,2019-06-16T15:12:40Z,PT9M40S,19815289,627309,12276
gVTWy2k0-tc,Comment faire un clip de l'été ? (légèrement cliché),2019-06-12T17:25:57Z,PT15M1S,7020873,290314,6365
L3pqPw9ipCg,Squeezie ft Joyca - Bye Bye,2019-06-08T15:05:11Z,PT2M51S,39339926,1109558,59664
UZLNgz1AqCE,Kezah ft Freddy - Mirador,2019-06-08T15:04:56Z,PT2M51S,55706893,1158338,52829
ZQjCh7oDRLo,Qui fera le meilleur hit de l'été ? (en 3 jours),2019-06-05T17:15:25Z,PT1H8M24S,22828383,700043,37878
HanfxLSk0a8,J'ai pris une méga douille (mais je l'ai cherché),2019-05-31T17:15:11Z,PT14M14S,12957348,518013,11535
qzSSOAl1FLE,3 histoires qui vont gâcher votre nuit (et la mienne),2019-05-25T16:34:00Z,PT14M31S,19614245,681074,38385
7bj3XZ0AQCU,J'apprends à dessiner et j'y arrive vite fait,2019-05-18T17:04:01Z,PT14M36S,13928136,590574,48405
Ji_dK9KzTng,Je découvre mon visage s'il était parfait,2019-05-08T17:15:55Z,PT10M23S,8098344,434597,13844
HRrbEm41pCU,"On a échangé nos styles... (ft Seb, Maxenss, Luciole)",2019-05-04T18:08:20Z,PT19M18S,12020108,496443,13722
0s8a2zx3clg,Cette caméra filme toute sorte de choses drôles (titre très long),2019-04-26T17:30:08Z,PT11M16S,12518914,521022,8283
j0LleIRihAM,ON ESSAYE DES OBJETS ÉTRANGES #4,2019-04-21T08:46:19Z,PT14M25S,29609951,791133,21125
KWdsHZ2OCkI,Comment devenir riche sur YouTube ? (6 techniques),2019-04-14T15:48:29Z,PT13M33S,7183373,447788,17254
QV9tsas8z_M,Le métier le plus dangereux du monde,2019-04-10T16:31:19Z,PT10M31S,16017865,589874,9737
7ASjZ6NfuA4,Quand on se rencontre dans la rue,2019-04-04T16:39:30Z,PT13M19S,10648598,541512,17770
T_4lXthmpj0,"L'ACADÉMIE DES CANCRES #2 (ft Laink, Terracid, Maghla)",2019-03-29T19:29:06Z,PT23M9S,18420106,571730,29701
sZFRwgErDiQ,Continuez à faire ça s'il vous plaît (les mods),2019-03-25T18:09:46Z,PT12M13S,6749933,335098,11743
VpRVq07A_Ak,Vous n'allez pas dormir... (3 vraies histoires d'horreur),2019-03-21T17:50:41Z,PT10M32S,15259895,594510,38810
5yx_We_8w2c,La nature est surprenante (genre ce crabe),2019-03-17T18:49:31Z,PT12M42S,12604893,528211,22766
6vVYUFumQCI,Réponse à Cyprien,2019-03-13T17:25:13Z,PT2M9S,33051551,1128758,61192
VfKlNLLK9NQ,Mon chien est le plus intelligent (objectivement),2019-03-10T17:23:59Z,PT12M48S,13627153,553140,30679
kuCv9TJbNh4,LA FIN DES YOUTUBEURS ? (non),2019-03-07T18:06:44Z,PT12M55S,6560227,446735,23407
MyITSot_amg,LES SPORTS IMPROBABLES,2019-03-04T18:37:29Z,PT10M40S,16201512,535536,16928
sEkbibtqbbI,CES GENS SONT DANGEREUX ⚠️ (Y'a quoi #2),2019-02-28T17:18:19Z,PT13M49S,8060410,582244,28754
J6ntbiGV7Vc,NOS PARENTS À NOTRE ÂGE,2019-02-23T15:31:48Z,PT17M9S,9218901,430836,11694
Rgt8wbx-OnU,SQUEEZIE - LE GAMING C'EST FINI,2019-02-20T17:29:05Z,PT3M37S,13036534,465968,31923
KsEErBliIjw,VAIS-JE ARRÊTER LE GAMING ?,2019-02-15T18:15:15Z,PT11M43S,6699903,356153,21245
S_a81xsZ6bc,LA TÉLÉ VA-T-ELLE DISPARAÎTRE ? (Y’a quoi #1),2019-02-10T14:35:52Z,PT11M13S,7041603,497808,31742
0lWmz76nB74,QUI ÉCRIT CES ARTICLES ET POURQUOI ? 🤔,2019-02-05T19:10:00Z,PT13M30S,8000753,428153,12417
f8p_kNZhSZo,3 HISTOIRES VRAIES ANGOISSANTES,2019-02-01T17:19:40Z,PT13M33S,17054853,630595,23190
j9HYtsxteW0,MON NOUVEAU DÉCOR ! (Setup 2019),2019-01-27T18:51:55Z,PT14M39S,7406173,493169,33657
3Ye5GJgZw8c,LES TEMPS FORTS SUR YOUTUBE (JANVIER),2019-01-22T18:43:16Z,PT12M29S,11500833,725646,38044
lXGYAoyabdg,"L’ACADÉMIE DES CANCRES ! (ft Seb, Luciole, Théo Bernard)",2019-01-19T16:33:29Z,PT24M59S,24669381,730980,25624
LSI-tcAuk90,REGARDEZ ATTENTIVEMENT CHAQUE IMAGE 🤔,2019-01-11T18:41:00Z,PT10M12S,19467269,693848,22476
DD-RH0VOrBs,LES MEILLEURS MOMENTS EN LIVE (2018),2019-01-06T16:19:27Z,PT12M9S,4478875,215314,4963
Gq30hwLYwq8,JE VIDE MON SAC !,2019-01-03T18:25:02Z,PT8M54S,4841853,423210,21555
jiV1tIVsuUU,Frenetics - I Feel A Man (Official Music Video),2018-12-26T13:57:54Z,PT3M14S,13346094,445174,35264
tL3-kd9zl_s,3 VRAIES HISTOIRES TERRIFIANTES...,2018-12-23T12:04:54Z,PT13M5S,17662209,823995,32376
0S-0jhWMYMc,SQUEEZIE - FREESTYLE DE TWITTER (ft Bigflo & Oli),2018-12-20T17:10:56Z,PT3M24S,35244484,822248,33898
IeJ1496NLIw,ON CRÉE UNE MUSIQUE EN 24H (ft Bigflo & Oli) #fin,2018-12-18T17:23:08Z,PT16M13S,8399557,395393,14708
QOaIYVrz_vc,LES COULISSES D'UNE GROSSE VIDÉO,2018-12-15T14:15:27Z,PT13M28S,3320070,194279,5435
N6d0wyShsyA,LA PREMIÈRE FOIS (Rainbow Six Siege IRL),2018-12-11T17:05:36Z,PT4M58S,8358341,543707,29396
facaLreaqZw,VOYEZ-VOUS LE VISAGE ? (Panorama fails + paréidolie),2018-12-09T11:01:17Z,PT10M30S,14597825,495137,14320
VnIbouZWfnE,IL Y A 10 ANS J'EN RÊVAIS !,2018-12-05T18:58:33Z,PT10M54S,5420588,277676,7527
9A8BCkT0J8M,CET HOMME FAIT CE QU'IL VEUT,2018-11-26T18:35:26Z,PT13M36S,12523970,555636,13024
-oiCAL2-tqI,ÇA DOIT S'ARRÊTER !,2018-11-22T18:13:11Z,PT12M36S,26722073,797561,31420
clIh2__gIR4,UN CAS MYSTÉRIEUX...,2018-11-18T17:18:03Z,PT12M23S,12831572,578281,18743
nvEITZp7XkU,J’AVAIS BESOIN D’EN PARLER,2018-11-14T17:51:23Z,PT10M38S,7299086,468522,28479
rjq6FJSAVJ0,1990 VS 2000 (Clash des générations),2018-11-06T16:48:53Z,PT3M47S,34473242,860870,71120
z_OWG_Z98xg,ATTENTION À NE PAS TOMBER ! (vlog dangereux),2018-11-03T18:36:22Z,PT10M55S,3640950,245019,9088
QjMss3eAQN8,DES INCONNUS SE MOQUENT DE MOI,2018-10-31T17:11:43Z,PT10M11S,7918211,384852,10953
Z4O0pieCzws,UN MYSTÈRE NON RÉSOLU,2018-10-18T17:45:31Z,PT10M11S,13420603,597604,25032
qJUw6HuF-Xk,JE NE DEVRAIS PAS EN PARLER,2018-10-14T14:14:02Z,PT12M23S,12906772,553350,11150
wK_JMe8F4Ug,CE JEU DEVRAIT ÊTRE INTERDIT !!!,2018-10-09T17:51:02Z,PT10M16S,7810397,441894,20977
XhM4uHNewAE,JE SURPRENDS 8 ABONNÉS AUTOUR DU MONDE ❤️🌍,2018-10-04T16:00:56Z,PT1H5M46S,16254817,596568,41678
5b8WRVDNC9A,ON ESSAYE DES OBJETS « FARCES ET ATTRAPES » (ft McFly & Carlito),2018-09-28T17:52:55Z,PT10M26S,22803505,665156,23665
KBfqmalp5xo,3 SCANDALES SUR SQUEEZIE...,2018-09-24T17:13:02Z,PT10M52S,20178741,684375,21405
3A4RAbWnvVM,UNE AFFREUSE DÉCOUVERTE...,2018-09-19T16:08:14Z,PT14M38S,15066110,636904,30846
BPrE5QEsugQ,J'AI RENCONTRÉ MON SOSIE !,2018-09-14T17:11:15Z,PT10M46S,20046726,874081,25919
bgluUp8VbaA,UNE ÉTRANGE CHAÎNE YOUTUBE...,2018-09-09T11:44:43Z,PT15M36S,12778470,575362,43896
DY1IRXQH8fk,JE LIS DES CRITIQUES...,2018-09-05T18:01:07Z,PT12M2S,8167769,521027,23671
R3Phv3h7GaA,SQUEEZIE - PAS TOUT SEUL,2018-08-31T16:31:10Z,PT4M15S,10026148,787321,58398
-ro7ZbLHVV8,À BIENTÔT ✌🏻,2018-08-07T17:03:53Z,PT7M2S,4983317,408337,36128
Uk7qtMV6HUM,3 RÉVÉLATIONS SUR SQUEEZIE,2018-08-03T17:21:48Z,PT11M28S,18524524,702701,63806
8YthjFKYpTY,MES 3 HISTOIRES D’HORREUR PRÉFÉRÉES,2018-07-28T13:05:42Z,PT14M,16659455,623322,54810
I3TzYJqVsxM,CECI EST UNE FOIRE AUX QUESTIONS #2 (FAQ Squeezie),2018-07-22T16:13:52Z,PT13M51S,6548876,370088,27460
0GroFwBjZYs,VOUS N'ALLEZ PAS FERMER L’ŒIL DE LA NUIT...,2018-07-18T15:21:28Z,PT11M38S,15368640,585686,44525
HiCdWuMWYV0,LES PHOTOS DE MOI PETIT ET INNOCENT #2,2018-07-15T09:00:18Z,PT11M22S,9702956,436596,13840
QiDH3fWEDVU,LES ERREURS D’INGÉNIEURS...,2018-07-11T18:18:28Z,PT10M4S,34198112,734292,18300
r1uBR-2ZqJc,NOTRE AMITIÉ SURVIVRA-T-ELLE ?!,2018-07-07T16:33:45Z,PT16M44S,9666718,318805,7969
fiNTJfBO5Y0,MES CHERS COMPATRIOTES...,2018-07-03T18:05:19Z,PT14M23S,13391501,544086,24254
6y5OUaMpCAA,UNE HISTOIRE PARANORMALE...,2018-06-29T17:04:44Z,PT11M27S,15246557,636262,48759
2A0B2EgrtPE,CE JEU DÉTRÔNERA FORTNITE ! (non),2018-06-25T19:14:37Z,PT10M27S,11701066,470572,19987
h_4Ve5B6nPc,LES AVIONS NOUS EMPOISONNENT-ILS ?,2018-06-19T17:01:59Z,PT10M11S,7488223,367999,20355
w_Be3vFdbCo,LE TEST POUR ENTRER AU FBI (100% officiel),2018-06-16T16:43:53Z,PT12M44S,12823017,462507,20743
kWLViAbabpM,UNE AFFAIRE INQUIÉTANTE...,2018-06-13T16:24:43Z,PT8M52S,14181120,730747,49984
3kPUyFEOMGM,UNE HISTOIRE ANGOISSANTE...,2018-06-01T18:55:59Z,PT15M49S,19052495,662800,57924
TurkUzz2uqI,J'AI RETROUVÉ MA CHAÎNE SECONDAIRE...,2018-05-28T17:30:02Z,PT14M50S,10628275,508425,17260
0lAWLb1tv8s,QUI POSSÈDE LE MEILLEUR JOUET ? (ft Maxenss & Seb),2018-05-25T16:30:22Z,PT13M47S,16045109,466514,14841
fZhIovdr8tM,CETTE NUIT VOUS NE DORMIREZ PAS,2018-05-21T16:53:53Z,PT10M16S,16333370,599418,63719
86mpIs7_DpQ,LES STARS SONT-ELLES DES CLONES ?,2018-05-10T16:59:51Z,PT10M55S,10226683,403698,21437
AFOB6NRugTA,UNE VIDÉO PAS DRÔLE MAIS INTÉRESSANTE #2,2018-05-07T17:00:00Z,PT11M5S,6032212,334040,11635
Of_ERZE21hw,SQUEEZIE - FREESTYLE DE POTES (ft Seb & Maxenss),2018-05-04T16:38:33Z,PT4M53S,17886846,573213,46260
C-6FGEkeUag,UN MESSAGE VOCAL FLIPPANT...,2018-04-16T16:50:37Z,PT8M33S,14781158,590875,93830
RDBprxmdKRQ,Un message sincère,2018-04-14T15:35:23Z,PT7M38S,4636226,572376,61633
VbvaPGLvmnI,LE DERNIER CHALLENGE DU TOP 1...,2018-04-12T17:57:25Z,PT9M34S,6942944,288870,10618
EuEXlALlCjE,LA VIDÉO COMME EN 2013,2018-04-09T18:20:27Z,PT10M3S,5729513,310262,16567
jq_8rxMaltw,"LE PLUS GROS CACHE-CACHE DE FRANCE ! (ft Carlito, Maxenss, Léo)",2018-04-02T18:02:26Z,PT19M34S,23646337,1001345,37290
HPM5FsypbM0,LES ROBOTS VONT-ILS DOMINER LE MONDE ?,2018-03-30T17:05:14Z,PT11M5S,8166884,375008,19947
il2XBlPuOi8,COMMENT S'OCCUPER D'UN BÉBÉ ?,2018-03-27T17:55:29Z,PT10M5S,12678172,385599,14362
PeLBnv-PUck,SUPPORTEREZ-VOUS CES IMAGES ?,2018-03-24T17:01:26Z,PT10M53S,11308684,442690,112078
HgpVwGQszrQ,IL VA CHANGER VOTRE VIE SENTIMENTALE...,2018-03-21T18:26:11Z,PT10M31S,7106393,325187,10823
VnD8UUdekeo,NOS SOUVENIRS SONT-ILS RÉELS ?,2018-03-17T18:26:35Z,PT10M6S,8677671,390195,26157
RmuowP5HiAc,COMMENT RÉUSSIR SUR YOUTUBE ?,2018-03-09T17:15:17Z,PT8M8S,7079825,512394,31578
iCYO-lhDwqg,JE ME BALADE SUR VRCHAT #2 (w/ Amixem),2018-03-02T17:11:38Z,PT12M11S,8635099,388274,7786
3qXRYIdEHTU,LES PETITES ANNONCES AMÉRICAINES #2,2018-02-26T18:35:55Z,PT8M33S,6625115,263921,7800
uGSu6mhk3RQ,SQUEEZIE - TOP 1,2018-02-19T18:17:06Z,PT2M44S,51499364,983796,62115
6sRmWKMUofk,JE ME BALADE SUR VRChat #1,2018-02-14T18:25:31Z,PT10M56S,10718399,455882,27056
WzKusbeJti0,LA VÉRITÉ SUR MAXENSS ET MOI...,2018-02-12T17:00:11Z,PT10M41S,8087881,378834,22057
ADiZAwzA1TE,LE SQUEEZIE COMEDY CLUB,2018-02-03T17:01:01Z,PT10M36S,5975911,288514,13744
hNS43l4qXvg,JE TESTE L'INTELLIGENCE DE MON CHIEN,2018-01-31T12:02:35Z,PT9M7S,11773078,408853,17174
knf0PIXHFpg,JE VOUS PIÈGE INCOGNITO,2018-01-26T18:46:19Z,PT7M15S,13123996,545016,21606
sOoTg6ihsZM,LES PETITES ANNONCES AMÉRICAINES,2018-01-17T19:15:52Z,PT8M5S,8518042,327255,7016
l9FDSxN0mUc,JE PENSAIS ME DÉTENDRE...,2018-01-14T18:15:58Z,PT9M28S,14608173,446851,10758
WqYCv4jry7U,J'AI CHANGÉ DE MÉTIER !,2018-01-12T18:35:20Z,PT12M21S,8058102,409037,20248
yWAcSmtDr5U,CES 6 DERNIERS MOIS SUR YOUTUBE,2018-01-04T19:40:15Z,PT11M35S,3774633,323210,19628
oQEG2ALOCes,J'AI RETROUVÉ MES DESSINS D'ENFANCE,2017-12-29T17:19:17Z,PT7M48S,10565307,412516,14639
T-7XRt4CxSw,10 YOUTUBEUSES 1 CHALLENGE,2017-12-26T16:06:02Z,PT9M38S,12886437,430863,19161
ePia7XI_1Ac,ON A PLEURÉ DE RIRE ! (avec Cyprien & Seb),2017-12-23T16:16:31Z,PT15M6S,12009464,377356,6193
OuwY9RJtB-I,QUAND J’ÉTAIS ENFANT,2017-12-17T14:06:43Z,PT8M1S,16939380,579567,19514
vMyvqDdFfcU,J'AI REÇU UN COLIS ÉTRANGE...,2017-12-14T18:03:50Z,PT9M11S,10003708,390286,8974
wHTIs_pii8M,1 CHALLENGE 10 YOUTUBEURS,2017-12-11T16:24:33Z,PT11M43S,16403350,607673,21906
tnzYQfuRNy0,VOS MEILLEURES CRÉATIONS !,2017-12-08T18:45:15Z,PT12M1S,10088133,349342,7502
Snt5cBMw3IQ,LE VRAI VISAGE DE NATSU,2017-12-06T16:41:11Z,PT8M58S,26417223,663912,33603
-0JHLsGYKGs,LA VIDÉO DE LA NOSTALGIE,2017-12-02T18:51:26Z,PT10M10S,9272199,363411,27300
e05rwHCTps0,JE TRAITE MA PHOBIE...,2017-11-29T18:42:14Z,PT10M52S,16468437,463499,67466
tbL61OdF8No,CE JEU ME TRANSFORME EN SAIYAN,2017-11-27T18:20:34Z,PT8M12S,20233489,499137,19822
JHDDkxLsYDw,QUAND J’ÉTAIS ADOLESCENT,2017-11-24T17:42:29Z,PT10M2S,23387408,710576,24267
54c_2LID52s,CETTE VIDÉO EST TRAGIQUE,2017-11-22T17:32:46Z,PT8M3S,8987892,361835,13647
gN_L27itbTA,SQUEEZIE - FREESTYLE DE L'AUTODÉRISION,2017-11-18T19:14:12Z,PT2M25S,21896837,782465,46607
h2l8hC6hdlA,JE SORS UN LIVRE !,2017-11-16T16:16:30Z,PT4M17S,3479134,228838,10274
Ka7F4wf7O28,19 MINUTES DE SUSPENS,2017-11-14T17:53:33Z,PT19M6S,8320326,376302,15259
exMNBvwCfRY,LES PIRES DOUBLAGES FRANÇAIS,2017-11-10T18:25:25Z,PT10M33S,16028648,495049,17375
J4euyCeAtkM,"1 MOIS APRÈS, JE REVOIS MON CHIEN",2017-11-04T17:40:31Z,PT10M7S,22218991,674042,45372
BVgXJ69Fzj8,JOUER À CE JEU = PERDRE UN AMI,2017-10-31T16:41:56Z,PT7M6S,6188861,237404,5941
Nx_-ZJPJiEI,LEQUEL D'ENTRE NOUS EST...?,2017-10-28T17:53:23Z,PT9M11S,16101918,459699,11985
P_EJ051o8yQ,LE JEU DE MON ENFANCE,2017-10-25T15:43:31Z,PT8M48S,13519916,427395,18197
ZNoc9utfbpg,VOUS ALLEZ FINIR EN SUEUR,2017-10-23T16:10:27Z,PT11M5S,9973117,346108,11885
f7E3EVpjjSo,JE PIÈGE MES ABONNÉS SUR OMEGLE,2017-10-20T17:09:54Z,PT9M9S,11407039,518464,17080
aTQZEP10BSo,SQUEEZIE VS NATURE,2017-10-13T17:12:58Z,PT11M42S,5233752,242088,8025
IhrcSaDesUA,VOUS NE DEVEZ PAS QUITTER LA VIDÉO,2017-10-11T17:28:24Z,PT10M26S,11474910,443644,23517
HuZTZzVvZ1E,J'AI FAILLI LE DÉSINSTALLER DE RAGE (Fangame #fin),2017-10-08T17:34:01Z,PT8M27S,6206494,286629,7722
GGePC2J42WU,UN ABONNÉ M'A ENVOYÉ SON JEU,2017-10-07T15:08:07Z,PT10M20S,7867553,320750,9752
JiuVSNualmE,DANS UNE MINE 90 MÈTRES SOUS TERRE (vlog Canada #fin),2017-10-03T15:36:38Z,PT8M49S,2894000,189824,8483
fwKSENnZ7oM,SQUEEZIE - FREESTYLE DU DICO (ft Bigflo & Oli),2017-09-30T16:43:40Z,PT3M8S,47398886,1125632,55932
CK1lGDlnR2I,ON RE-FAIT UNE MUSIQUE EN 1H ! (ft Bigflo & Oli),2017-09-29T17:20:19Z,PT12M8S,14000182,630449,21775
qhPe8imp1XM,ON ESSAYE DES OBJETS ÉTRANGES #2,2017-09-27T17:50:55Z,PT10M49S,38750657,813252,27460
Ga8Wfy-dTCQ,J'ADOPTE UN CHIEN !,2017-09-23T15:52:58Z,PT9M35S,20876924,789274,61456
mz6qQALSzSA,CET HOMME FRÔLE LA NOYADE (Vlog Canada #2),2017-09-20T15:21:34Z,PT13M53S,4694765,238126,9761
oXmo946xIYA,J'AI EU LA PEUR DE MA VIE (Vlog Canada #1),2017-09-16T15:26:12Z,PT14M12S,6218434,256005,13310
vUO1RDgkVgE,"CETTE VIDÉO = RIRE ILLIMITÉ (avec McFly, Carlito & Maxenss)",2017-09-14T17:35:38Z,PT17M2S,18888610,503554,26844
6xqPKUx1WOI,LA VIDÉO PAS DRÔLE MAIS INTÉRESSANTE,2017-09-11T16:35:58Z,PT13M36S,9680999,489187,13855
2BWX2lWY584,VOS MEILLEURS MONTAGES PHOTO #2,2017-09-05T16:24:32Z,PT7M9S,14870384,432564,8693
dqve5hStevY,COMMENT SÉDUIRE UNE FILLE ?,2017-09-03T11:26:13Z,PT9M18S,7339937,350530,12726
QEeta0MRv4s,ESSAYEZ DE TROUVER LE PAYS CORRESPONDANT,2017-08-31T16:41:32Z,PT8M34S,8048457,277861,16475
us4byQZ3wtE,VOS DESSINS LES PLUS FOUS !,2017-08-28T17:53:13Z,PT12M21S,19048700,518949,20285
U-9rn56VY-E,J'INFILTRE UN RÉSEAU D'ARNAQUEURS,2017-08-22T17:14:59Z,PT10M2S,27542772,960717,40855
L0VexU10ZZo,JE LANCE MON RÉSEAU SOCIAL (Startup Company),2017-08-20T17:29:03Z,PT9M6S,5659796,257984,6362
9RkpIrYsIf4,UNE HISTOIRE INATTENDUE...,2017-08-17T18:53:19Z,PT8M25S,4315570,241327,11334
XnjSNdSv7EQ,CE NIVEAU M'A RENDU DINGUE,2017-08-15T17:00:01Z,PT7M31S,8438242,307857,14246
xrkmdXyOaHg,JE DÉCOUVRE MES ORIGINES...,2017-08-11T16:24:58Z,PT6M20S,7124670,330428,14861
wQ62355LXd8,SQUEEZIE : LES MEILLEURS MOMENTS,2017-08-08T16:04:43Z,PT10M15S,4363464,202674,4912
1_73cJ65MMs,MON TATOUAGE DU CANADA,2017-08-04T16:17:06Z,PT2M50S,3678039,194836,13018
SQrCA0OOc20,LE PIRE SITE D'IMAGES TÉLÉCHARGEABLES,2017-08-01T16:18:06Z,PT6M44S,7482302,272461,6415
o5PioDAAW00,SAVEZ-VOUS VRAIMENT PARLER FRANÇAIS ?,2017-07-29T15:45:54Z,PT7M42S,5188618,236062,8490
D9dl0Wyusok,LES MEILLEURS MONTAGES PHOTO DE MOI,2017-07-24T17:14:14Z,PT5M37S,10662028,419437,7068
I6eHRMbd47s,CET OBJET NOUS A RENDUS FOUS,2017-07-22T16:28:35Z,PT10M56S,23975826,596213,16500
tKSudPji8aU,À QUOI RESSEMBLAIT YOUTUBE IL Y A 6 ANS ?,2017-07-20T16:12:23Z,PT8M35S,8656968,353990,10530
WzKAujAqFGw,Je ne me forcerai plus...,2017-07-18T18:12:27Z,PT6M21S,4039728,404859,45102
vMFTD21xyEk,CONNAISSEZ-VOUS VRAIMENT VOS AMIS ?,2017-07-16T18:04:30Z,PT8M3S,18904135,538718,10941
iXuFg3wv1AA,ON FAIT UNE MUSIQUE EN 1H (ft Bigflo & Oli),2017-07-14T18:17:20Z,PT10M37S,24844726,772700,35120
6wMids1hD4U,J'ESSAYE DES OBJETS ÉTRANGES,2017-07-12T17:29:19Z,PT8M54S,14040921,456706,9379
CwADxbEAVnU,TU CRIES TU PERDS CHALLENGE,2017-07-11T17:24:05Z,PT12M21S,11058937,390132,42536
2qN5Qhh-KZI,DEVINEZ LE PRIX DE CES OBJETS,2017-07-09T15:51:51Z,PT9M11S,5561138,220663,5256
Md8HdIT10ag,OÙ EST SQUEEZIE ?,2017-07-07T16:27:51Z,PT6M57S,4744114,194732,5994
qmhlAi6hETI,J'AI PRIS LA GROSSE TÊTE...,2017-07-05T18:56:23Z,PT6M43S,11487130,425945,13347
p17z7K7CdVo,MAKING OF - PLACEMENTS DE PRODUITS,2017-07-03T16:15:54Z,PT8M2S,5179066,283127,8153
oFMh23ez5gw,SQUEEZIE - PLACEMENTS DE PRODUITS (ft Maxenss),2017-07-01T15:00:40Z,PT4M24S,40049155,982732,59549
ZffTU2-koX8,"ON JOUE À ""TA MÈRE EN SLIP"" ! (avec Natoo, Cyprien & Julfou)",2017-06-30T17:12:03Z,PT12M24S,9146667,308823,6671
y32mIxeOjP4,CHOISIREZ-VOUS LA VIE OU LA MORT ?,2017-06-28T15:19:26Z,PT8M23S,6502667,256200,7663
EvWKe0epXLk,CES 365 DERNIERS JOURS SUR YOUTUBE,2017-06-25T17:47:26Z,PT15M3S,4519998,410963,31212
_-K2gDm44zM,J'ESSAYE DES LUNETTES ANTI-DALTONISME,2017-06-20T17:11:22Z,PT7M55S,6519811,291961,8532
WFhwah3HxyU,MA NOUVELLE CARRIÈRE,2017-06-17T17:19:32Z,PT7M12S,11181618,319091,6791
lXxFBNo6Im8,LE MEILLEUR JEU ENTRE AMIS #2,2017-06-16T16:49:21Z,PT8M15S,8496350,320533,6672
jvS4ACdE3Yw,CECI TRANSFORME TON DESSIN EN PHOTO #2,2017-06-13T17:21:29Z,PT6M31S,6794712,240150,5196
h60xnxUmDiQ,LES JEUX QUAND T'AVAIS 8 ANS,2017-06-11T15:32:14Z,PT7M26S,10505483,335229,10491
P8PI1HqhxWw,LE MEILLEUR JEU ENTRE AMIS,2017-06-09T15:44:24Z,PT7M49S,15075527,472893,8524
kB7xcPqYHWQ,LA VISITE GUIDÉE DE SQUEEZIE,2017-06-07T16:38:03Z,PT7M32S,6845716,251368,10926
sMnoK9JxZOQ,LES VIDÉOS DE MOI PETIT ET INNOCENT,2017-06-06T18:19:43Z,PT8M54S,13463679,459054,12869
nAeITInLlww,LES NOUVEAUX SITES WEB DU FUTUR,2017-06-03T16:30:28Z,PT7M53S,8195775,263568,4926
bSf6l6-7gwM,JE SUIS DALTONIEN ! (pour de vrai),2017-05-31T16:13:27Z,PT6M33S,8534456,350409,41507
LQT5Xhwc5JE,L'HISTOIRE D'UN MEC QUI VEUT PÉCHO...,2017-05-27T16:19:04Z,PT9M19S,8222625,280084,6050
Si6Dk2RwLDo,MON FRÈRE M'HUMILIE EN VIDÉO,2017-05-26T16:06:18Z,PT7M33S,9309830,333762,7284
z7UnSnHqCAs,QUELLE NOTE A VOTRE CERVEAU ?,2017-05-24T17:29:22Z,PT6M52S,4517111,181810,5253
N_aMDX9LZmA,LES CHAÎNES YOUTUBE JAPONAISES,2017-05-23T17:19:04Z,PT9M12S,10169858,368422,12200
SG5c8fUS9c4,T'AS CHANGÉ SQUEEZIE (MUSIQUE),2017-05-20T17:18:14Z,PT3M54S,6353271,260917,14125
OLGskr4Gzak,LA BRIGADE HAND SPINNER,2017-05-19T16:29:16Z,PT2M10S,4460723,233532,11337
iB0DxwQEgmc,LES PIRES MONTAGES PHOTO,2017-05-17T17:58:06Z,PT7M,11867276,377410,7956
6ID6Tu60JoQ,ESSAYEZ DE TROUVER LE NOM DE LA VILLE,2017-05-16T17:25:12Z,PT7M23S,5028268,237382,8195
y5mAYy8shXM,JE NE DÉCEVRAI PAS MON PEUPLE,2017-05-14T15:18:39Z,PT8M17S,7864981,282565,6316
jUuP-qbpKd0,ESSAYEZ DE DEVINER LA LANGUE UTILISÉE,2017-05-12T16:28:59Z,PT7M45S,4484387,220859,11605
HxIogmldWoY,SQUEEZIE EST-IL NUL AUX JEUX VIDÉO ?,2017-05-10T17:31:04Z,PT7M20S,6020697,255164,10151
rvEwXV6UPRQ,MANQUER DE PQ OU MANQUER DE DENTIFRICE ?,2017-05-07T16:35:50Z,PT7M25S,15590142,399951,20299
0K-SL7KIfM8,LE PIRE MOMENT DU JEU (Outlast 2 fin),2017-05-06T16:21:49Z,PT45M8S,4022153,201183,13047
F28eaPwJc-4,LE GÉNIE DU NOPE QUIZ !,2017-05-05T15:48:38Z,PT9M5S,8694246,297078,6379
r_vs7SG-bIM,NE REGARDEZ PAS SANS COUCHE (Outlast 2 #5),2017-05-04T18:50:08Z,PT44M1S,3332105,125299,11423
826VU7XSwOg,LA CHANSON DU BRUIT (MUSIQUE),2017-05-03T16:47:33Z,PT2M48S,6308054,268246,20395
WUTQACMsezw,VISITE D'UN HÔPITAL ABANDONNÉ EN PLEINE FORÊT,2017-05-02T16:24:33Z,PT15M29S,5291254,236554,22504
6hjuhhmcIHE,VOUS N'OSEZ PLUS CLIQUER ?.. (Outlast 2 #4),2017-05-01T16:28:32Z,PT34M2S,3051294,127792,11372
DzTNUn7AzGQ,DÉSHABILLER POUR SAUVER LE MONDE (Jeu incroyable),2017-04-30T17:21:39Z,PT9M27S,8457201,230631,5526
OCdIZelHh5I,VOUS N'EN DORMIREZ PLUS... (Outlast 2 #3),2017-04-29T16:21:03Z,PT26M36S,3256401,124535,10256
XgnQPw4mkyo,COMMENT CONSTRUIRE SON PC GAMING ?,2017-04-28T17:09:31Z,PT6M51S,5700165,222336,4918
U7CbwumGlxo,TON PANTALON APRÈS CETTE VIDÉO (Outlast 2 #2),2017-04-27T16:23:51Z,PT38M44S,5036235,182115,13549
0QDj-ikuUu8,J'AI ATTENDU 3 ANS POUR Y JOUER ! (Outlast 2 #1),2017-04-25T15:17:30Z,PT25M12S,7925394,284464,19092
KdrcHZv7eAA,L’EXPÉRIENCE LA PLUS FOLLE DE MA VIE (vol 0g),2017-04-21T16:17:50Z,PT10M29S,9624745,393407,12964
P_642xQtF2c,LE MEILLEUR FACE SWAP,2017-04-20T16:31:27Z,PT9M56S,5653875,234353,6719
3ozpiQ4m5nI,COMMENT DRAGUER SUR TINDER ?,2017-04-18T17:11:50Z,PT8M57S,17268112,544638,11719
eQTqPQ0SnVE,LE SIMULATEUR DE SOIRÉE AMÉRICAINE,2017-04-16T14:43:25Z,PT8M51S,13437416,373848,14922
Eh58fhjWEPo,CE JEU PIÈGE TON CERVEAU,2017-04-14T17:43:15Z,PT9M36S,4598750,173522,5302
LCby3yfV-Eg,QUAND ILS CROISENT MON CHEMIN (Mirage: Arcane Warfare),2017-04-12T18:04:47Z,PT8M6S,3617992,126642,4993
GMUmBi2JUb8,QUE CHERCHENT LES GENS SUR INTERNET ?,2017-04-11T17:10:14Z,PT7M46S,7058131,266369,6344
tCnGErZeqFw,MAKING OF - OVERWATCH RAP BATTLE,2017-04-09T16:49:06Z,PT6M42S,5502281,181603,4957
_ZPpU7774DQ,OVERWATCH RAP BATTLE,2017-04-07T15:31:14Z,PT5M25S,69731262,1204962,79043
WXFId_kyotI,"JE TESTE LA ""RÉALITÉ MIXÉE""",2017-04-05T18:59:45Z,PT11M28S,7317115,225765,5726
YhRdjdGNCKE,STOP AU HARCÈLEMENT,2017-04-04T16:33:21Z,PT8M3S,5587988,510460,56086
owLwbqEn_ns,JE M'AUTO GOOGLE,2017-03-31T17:22:20Z,PT8M38S,12692366,441743,16085
gJuC7VDrSGY,VISITE D'UN HÔTEL ABANDONNÉ AU JAPON,2017-03-28T16:06:56Z,PT11M,4962309,200851,10427
f42xyvczZ3E,MON NOUVEAU STYLE (Vlog Japon #3),2017-03-26T15:05:39Z,PT10M3S,5611631,218774,5956
fRk-Wgnrxz8,OÙ VA L'ARGENT DES ABONNÉS ? (Vlog Japon #1),2017-03-24T16:32:34Z,PT9M8S,3302835,102830,2906
JVi8lCQQtGo,LE BAIN JAPONAIS QUI TE BRÛLE (Vlog Japon #2),2017-03-22T18:13:22Z,PT8M27S,9869148,305056,8610
KmgCUFgfQOQ,AVEZ-VOUS CE TROUBLE ?,2017-03-21T18:07:22Z,PT8M58S,4471732,207466,14918
HYoJxYVXFGc,SON NOM EST SQUEEZIE EASTWOOD (Compilation de jeux),2017-03-17T16:30:08Z,PT7M41S,8651128,239634,4682
fL_sb7nf3FY,CE JEU RÉAGIT AUX BRUITS !,2017-03-15T16:01:07Z,PT8M35S,20090915,511230,21008
eEEg3RMhZLg,LE MEILLEUR MOYEN D’APPRENDRE UNE LANGUE !,2017-03-11T17:41:47Z,PT7M36S,3567148,189409,7178
3t77hjru6fE,LES HAUCHARD PARTENT AU JAPON,2017-03-10T16:34:23Z,PT3M29S,2103880,122382,4032
5sNNzWVhGVQ,LE PRIME,2017-03-09T19:41:58Z,PT21M29S,2889919,138552,8507
KIJyMU-lO9Y,TOUT LE MONDE ÉCOUTE LE CAPITAINE !,2017-03-07T19:35:07Z,PT9M6S,5796946,200316,6412
23RtNcSKUJw,MON PLUS GROS PROJET,2017-03-06T18:57:07Z,PT4M23S,3295169,196043,14270
FLtMPJSh0AQ,UNE NOUVELLE FORME DE MASSAGE...,2017-03-04T16:56:35Z,PT8M24S,6318598,203873,4752
mmo217AwfjI,CECI TRANSFORME TON DESSIN EN PHOTO,2017-03-03T18:19:15Z,PT8M59S,9101829,273699,7549
XLC5EagMK1I,J'AI SUIVI L'ENTRAÎNEMENT D'UN ASTRONAUTE,2017-03-01T19:20:37Z,PT13M47S,6437310,266706,9309
QUoymPzclj8,MON NOUVEAU PROBLÈME...,2017-02-24T18:17:37Z,PT6M9S,12110769,519446,27245
ykYLskMUSC0,CE JEU MET À L'ÉPREUVE TON CERVEAU,2017-02-21T19:09:30Z,PT8M29S,9935470,331790,6526
boZAodfNSXk,100% DE CHANCE ! (Mise à jour Nope Quiz),2017-02-18T16:48:11Z,PT8M13S,8851596,303558,7561
CUEwe-P-U6c,LA FIGURINE QUI COÛTAIT 300€,2017-02-15T18:51:31Z,PT10M1S,11013988,299608,10136
W5fEVDM_E0g,LE JEU QUI TE MET BIEN,2017-02-14T18:17:05Z,PT6M32S,5668947,230538,9386
Rk7ndCISJw0,CETTE LAME A DÉCOUPÉ MICKA (For Honor),2017-02-10T19:55:25Z,PT6M50S,3255113,121250,3512
eWQhrzudo9k,LA VIDÉO SCANDALEUSE,2017-02-08T19:10:55Z,PT6M42S,6980145,255498,7846
cA3jkKH8Vy0,QUI SUIS-JE VRAIMENT ?,2017-02-07T18:48:37Z,PT10M34S,6201341,288224,31845
6Q8Hw3XCwhs,DESCENTE AUX CATACOMBES INTERDITES...,2017-02-04T11:59:59Z,PT21M40S,9586168,348788,19333
OwwJRRQMNcE,LES JEUX OLYMPIQUES DE LA CONNERIE,2017-02-03T19:45:13Z,PT8M44S,7874876,293682,5887
rQQ5p3uaOe8,VRAI OU FAUX ?,2017-02-01T17:59:27Z,PT6M31S,4243078,181103,5506
_-qk8EeNMts,JE RÉAGIS AUX GENS QUI RÉAGISSENT À MOI QUI RÉAGIS,2017-01-31T18:49:24Z,PT8M5S,9059868,421745,13786
wos4y4Z2Z2s,INSPECTEUR SQUEEZIE : SA PLUS GRANDE ENQUÊTE,2017-01-28T16:41:07Z,PT40M28S,5298797,188773,12781
vaWoh1npZVY,MON VOISIN ME TRAQUE... (Hello Neighbor #2),2017-01-27T17:46:09Z,PT10M2S,9578645,409841,12880
bzifzvhgwQw,LE JEU VIDÉO DES CULOTTES !,2017-01-25T19:16:04Z,PT7M12S,3298883,126178,4781
8dYXrQL9A6U,FAIL OU RÉUSSITE ?,2017-01-24T17:06:43Z,PT11M27S,5720485,192627,9167
nVdq6nWfHUo,QUAND TON POTE BUG SUR UN JEU VIDÉO,2017-01-22T16:53:30Z,PT7M6S,4918443,164648,4176
3YPqIOi3T0Q,LE TRYHARDER DE LA PLEINE LUNE,2017-01-18T19:40:40Z,PT9M48S,5966092,254259,11959
2KcTwRtVaNg,JE PLEURE DEVANT MES ABONNÉS,2017-01-17T16:37:34Z,PT6M29S,12119076,382002,15192
g_-bbuRPLwo,UN DÉLIRE DE MEC BOURRÉ (Compilation de jeux),2017-01-14T17:55:05Z,PT7M2S,13756402,350855,5926
AYTRWONDV6w,MON JEU DE SOCIÉTÉ PRÉFÉRÉ !,2017-01-13T18:22:41Z,PT10M4S,11477928,355266,9686
Jslsi62utWM,LE POISSON-PÉNIS D'ASIE !,2017-01-08T16:57:18Z,PT6M28S,6934488,275711,9611
zw0ri-YBaX0,J'AI TIRÉ AVEC UNE ARME À FEU,2017-01-06T18:05:14Z,PT6M41S,5183929,233193,9897
