video_id,title,published_at,duration,view_count,like_count,comment_count
lkhwNZQOcIc,QUAND J'ÉTAIS PETIT ET INNOCENT !,2014-08-05T17:33:58Z,PT8M5S,18329465,381927,27484
kGo_t6jWgeg,NE RIEN CÉLÉBRER AUX TOILETTES ! - The Cursed Forest (2),2014-08-03T16:07:31Z,PT7M30S,2272385,64585,2679
n5uZaa8BtyM,COMMENT BIEN DESSINER UN POKÉMON ?,2014-08-01T17:50:04Z,PT7M15S,5820916,119262,9345
SQV_Ez0LOKs,QUELLE HORREUR SE CACHE DANS CE SEAU ? - The Cursed Forest,2014-07-30T17:21:00Z,PT10M52S,2510081,70407,7478
TzXYPritK0E,BIENVENUE SUR MA MAISON FLOTTANTE ! - The Forest 5,2014-07-27T16:19:03Z,PT6M51S,3798131,76517,3096
SxBU92WrFZI,WASSUP GOAT ?!,2014-07-25T17:51:57Z,PT7M59S,5295045,79198,3659
Jvq8X0ETOrw,NE LE REGARDEZ PAS DANS LES YEUX ! - The Unknown,2014-07-23T17:32:33Z,PT7M3S,2411914,50424,2840
t2I7FU-XSAA,NE JOUEZ PAS À CES JEUX ! (Compilation),2014-07-22T17:04:14Z,PT7M4S,5203430,99773,3510
e1vHFriNPSw,"NE PANIQUEZ PAS, VOTRE COU EST CASSÉ. - Vanish",2014-07-20T16:06:24Z,PT8M56S,6352071,108325,5235
GGK-ov8Hxe4,MELON BOMBER ! (Garry's Mod),2014-07-18T16:06:22Z,PT7M9S,5441946,76237,3394
PDDMcNEsbUc,COMMENT FINIR EN POSITION FŒTALE SOUS SON BUREAU ?,2014-07-16T18:54:50Z,PT7M35S,6467188,76271,3962
AYczhPlqiqg,FRAPPÉ POUR AVOIR VOULU UNE GLACE ! (Compilation de jeux),2014-07-15T16:55:22Z,PT6M41S,6882196,110389,5299
i2trt8ygrX4,LE MÉCHANT QUI NE RESSEMBLAIT À RIEN ! - The Hat Man,2014-07-13T15:59:33Z,PT9M5S,2470090,55641,3042
GEXClo80Au0,DEVINEZ QUI EST DE RETOUR ?!,2014-07-11T17:08:06Z,PT7M20S,5512080,102729,4233
lTGLL4SlxzI,NE JAMAIS ESSAYER D'IMITER UNE STAR ! (2),2014-07-09T17:34:05Z,PT5M38S,9046223,122901,13630
Rqwl-kz3rtU,LOUÉE SOIT LA BANANE ! - Murder 5 (Garry's Mod),2014-07-08T15:53:41Z,PT8M31S,6751118,98908,3847
U0oJ10DW8es,DAT-EPIC-WIN ! - Shi No Mori,2014-07-06T16:49:44Z,PT5M11S,2256089,38230,3670
6cSWGiE6Ebk,"DES CHEVEUX, DES CHEVEUX PARTOUT ! - The Grudge (3 & fin)",2014-07-04T14:52:57Z,PT8M49S,2616950,57688,3860
jJJqATgnbgs,NE JAMAIS ESSAYER D'IMITER UNE STAR !,2014-07-02T18:59:02Z,PT5M22S,11597916,198557,15093
UQvzYV5NrDo,COMMENT SÉDUIRE UNE INDIGÈNE ? - The Forest (4),2014-07-01T15:45:31Z,PT8M43S,4273372,77751,3655
SrUV8yRJyIs,JE NE PEUX PLUS CONTINUER À Y JOUER ! - The Grudge (2),2014-06-29T17:01:33Z,PT13M37S,3766055,64449,7044
M1ZBCUjubEg,DANSER N'IMPORTE COMMENT N'IMPORTE OÙ ! - Default Dan,2014-06-27T15:59:28Z,PT7M50S,5128322,78534,4476
DoYc2mZ0Csk,LE SIMULATEUR DE TERREUR ! - The Grudge (1),2014-06-25T16:55:56Z,PT13M21S,5519886,103791,13764
EDmVI0Zk-ZA,VOUS NE TROUVEREZ PAS MEILLEUR ENDROIT !,2014-06-22T17:32:24Z,PT6M11S,7115349,178991,38302
3ZZ4hI7LtGc,ILS NE SONT PAS QUI VOUS PENSEZ... - SlendyTubbies 2,2014-06-21T17:42:44Z,PT6M46S,2836933,54197,2685
k0F21AiHYB8,DES LEGOS PARTOUBLBLBLBLBL ! - Smash (2) (Counter-Strike: Source),2014-06-20T16:18:28Z,PT7M56S,9221568,117109,4606
Sf9I-MA8iCg,QU'EST-CE-QUE C'EST QUE CE SIAMOIS ?! - The Forest (3),2014-06-18T16:47:16Z,PT9M42S,4313840,67806,2837
Cp15otxd_Uw,"DR ZOIDBERG, DR ZOIDBERG! - Goat Simulator (5)",2014-06-15T17:13:22Z,PT9M1S,5738748,101492,4332
OBgkJNzxEek,RIEN NE PEUT STOPPER JIM ! - Turbo Dismount (3),2014-06-13T16:37:46Z,PT8M31S,6875133,91997,2827
xQ6jGzR7gTw,ÉDUQUEZ CETTE CHÈVRE ! ;_; - Goat Simulator (4),2014-06-11T17:13:02Z,PT10M,10923942,157416,5690
YmFr6rrJXrI,VOUS ÊTES GÉNIAUX : 22 536€ POUR l'ASSOCIATION !,2014-06-10T15:37:14Z,PT3M18S,1426023,55480,4190
s4jXfIZFnTY,LA TRIBU DES ATTARDÉS ! - The Stomping Land,2014-06-08T16:01:35Z,PT9M36S,4995312,86009,3073
seLT0CkC_AQ,NE ME TOUCHEZ PAS PROFESSEUR XAVIER ! - Among The Sleep (3 et FIN),2014-06-06T15:44:03Z,PT9M53S,3932867,85954,4323
Fi59Bdx6sJM,NULLITÉ.EXE A CESSÉ DE FONCTIONNER. - The Forest (2),2014-06-04T16:52:43Z,PT8M33S,3571832,83447,3552
yAgp7UvxRnE,LA FEMME FOUGÈRE EST LÀ ! - Among The Sleep (2),2014-06-03T16:00:06Z,PT8M26S,3465080,70422,2564
gZ5rxET8BtI,COMMENT NE PAS SURVIVRE DANS UNE FORÊT ? - The Forest (1),2014-06-01T16:00:57Z,PT9M31S,5292694,139547,5955
if4fYiSOCm4,L'ÉVASION D'UN BÉBÉ ! - Among The Sleep (1),2014-05-30T18:32:52Z,PT11M21S,7812517,137010,4784
OrIWFfg73uo,LE MONDE DES FACEPLANTS ! - Smash (Counter-Strike: Source),2014-05-29T16:58:45Z,PT7M17S,7464252,113380,3650
xICeUFqWM48,NE JAMAIS SAUVER UNE PRINCESSE ! - Strange Adventure,2014-05-27T17:39:14Z,PT8M29S,6207717,104239,3481
yUurPiAopck,COMMENT FAIRE UN GÂTEAU PARFAIT ? - Baking Simulator,2014-05-25T16:11:15Z,PT5M56S,5866631,86202,3247
FuCALGvdSBc,CHOQUÉ DEVANT TANT DE TROLLAGE ! - BattleBlock Theatre,2014-05-23T17:26:23Z,PT11M25S,7376652,118984,3543
sY3wYyYxWg0,NE PAS REGARDER SI SENSIBLE ! - Daylight,2014-05-22T17:40:14Z,PT9M46S,2427255,66998,4160
6yDKrzKu_ZY,COMMENT BIEN SE FAIRE VICTIMISER ? - Nether,2014-05-20T16:59:40Z,PT8M16S,3775141,62769,2208
6NqYicZ81SM,C'EST QUOI CE B#RDEL ?! - DreadOut 2 (FIN),2014-05-18T15:31:22Z,PT6M29S,2027096,39733,1364
3XNQ-QtAXEk,PERSONNE NE PEUT ME RÉSISTER ! - Murder 4 (Garry's Mod),2014-05-17T16:05:30Z,PT7M43S,6577844,95448,3106
uRHKqmGZKgc,LE FANTÔME AUX CISEAUX ! - DreadOut 1,2014-05-16T17:02:39Z,PT10M33S,3352840,62714,2569
fLDXeH8VXvY,QUEL EST CET AFFREUX VENTRE ?! - Grave,2014-05-14T16:01:23Z,PT6M56S,4117144,73490,2605
R0uAVmwHgUk,TROP GROS POUR ÊTRE PENDU ! - Outlast: Whistleblower 3 (fin) (DLC),2014-05-11T16:06:16Z,PT10M15S,3480378,95227,4201
ovgAOysGNH8,COURIR OU MOURIR ! (OU RIRE) - Speedrunners,2014-05-10T17:42:46Z,PT9M26S,5940093,102288,2737
nVAuVCIRuvs,TOMBER TOMBER TOMBER : ÇA SUFFIT ! - Outlast: Whistleblower 2 (DLC),2014-05-09T17:17:26Z,PT10M20S,2663100,45018,1690
HgdQRSP-lvo,L'HOMME NU À LA SCIE ! - Outlast: Whistleblower 1 (DLC),2014-05-07T17:19:45Z,PT8M59S,4066467,70839,2668
7EBLDgNbcqs,MINECRAFT VEUT ME TUER ! - Deathrun (Garry's Mod),2014-05-04T17:00:27Z,PT6M27S,8183935,83554,2596
lLQNySypjRk,ELLE A BESOIN D'UN DENTISTE ! - Terrorift,2014-05-02T17:16:12Z,PT7M22S,3897563,54744,3126
795Msr_nffM,À MOI LA LIBERTÉ ! - Ba_jail 2 (Counter-Strike: Source),2014-04-30T17:39:52Z,PT9M21S,12231831,165985,6002
vfDOHJ1j8Oc,LA REINE DE LA FARINE ! - Question Time 10,2014-04-27T15:30:28Z,PT3M2S,10183790,180888,16492
zUtsgmSyUgQ,MOURIR DE RIRE DEVANT UN JEU ! - Chivalry Mods,2014-04-25T17:29:46Z,PT5M59S,7274874,99823,2991
Q2szNQuGnOc,ELLE VEUT ENTRER EN MOI ! - Dungeon Nightmares,2014-04-24T16:09:13Z,PT8M1S,2523550,61549,3371
e78LzwRkqA0,LA RAGE DU PÈRE NOËL ! - Viscera Cleanup: Santa's Rampage,2014-04-22T16:52:50Z,PT7M7S,4571869,58695,2219
ggnc2H34ULU,RESPECTEZ MON AUTORITÉ ! - Ba_jail (Counter-strike: Source),2014-04-20T15:50:04Z,PT10M24S,17731799,189656,7377
yKDr9G8t5RY,L'HOMME QUI ENCAISSAIT LES COUPS ! - Trials Fusion,2014-04-18T15:57:37Z,PT8M37S,5098410,71135,2105
bUAgf3uFWLs,"QUOI QU'IL ARRIVE, JE PASSERAI ! - Turbo Dismount 2",2014-04-16T16:49:49Z,PT7M38S,8541928,107495,3284
NsXm01MXa6Y,LE ZAPPING DE LA BÊTISE !,2014-04-15T16:12:27Z,PT10M5S,5374985,137613,4272
C_5gg7czHSM,MOURIR D'UNE MANIÈRE ATROCE ! - Oculus Rift Best Of,2014-04-13T15:29:41Z,PT6M40S,5233310,81513,2446
6XLiQsfBn-I,JE SENS SA PRÉSENCE... - Maere: When lights die (Oculus Rift),2014-04-11T16:10:54Z,PT7M1S,4859508,67534,4110
7qftjQSTtWY,PARTY GOAT ANTHEM ! - Goat Simulator 3,2014-04-09T17:18:13Z,PT7M2S,4345815,72391,3191
c1S1Ch0e4Ls,2 MILLIONS D'ABONNÉS : RÉALISONS LEURS RÊVES !,2014-04-08T15:45:08Z,PT3M11S,1986027,69784,9245
bJois_pwR-Q,COUREZ POUR VOTRE VIE ! - Escape Pedo Bear (Garry's Mod),2014-04-06T16:51:16Z,PT8M18S,9296850,105922,5259
BMdZfd0N5YY,L'INTÉRIEUR D'UNE MAISON HANTÉE ! - Linger (Oculus Rift),2014-04-04T17:47:03Z,PT7M39S,3542207,54684,2813
QuPRQkEHQI8,LA PIRE EXPÉRIENCE DE MA VIE ! - Oculus Rift Test,2014-04-03T17:06:20Z,PT4M56S,7262778,119613,5204
n5N9-YizhgA,CECI N'EST MÊME PLUS UNE CHÈVRE ! - Goat Simulator 2,2014-04-01T16:49:03Z,PT8M1S,6946467,110405,3809
tYY9T2b-J40,LA FOURBERIE D'UN PIRATE ! - Chivalry: Deadliest Warrior,2014-03-30T16:36:18Z,PT7M24S,3094558,45598,1932
WYxvvqehDBM,"ÊTRE UNE CHÈVRE, ÊTRE UN GANGSTER ! - Goat Simulator",2014-03-28T19:12:27Z,PT7M13S,5710351,83730,4179
edd5W1mGIaA,"BILLY, LE GOSSE QU'ON DÉTESTE TOUS - Babysitter Bloodbath",2014-03-26T18:11:19Z,PT8M11S,3301431,55688,2016
7fOeZPiZXVE,SORTEZ D'ICI TOUT DE SUITE ! - Murder 3 (Garry's Mod),2014-03-23T18:19:36Z,PT9M40S,5981483,66915,2639
W4r77GItK6k,COMMENT AVOIR UN TEINT PARFAIT ?! - Question Time 9,2014-03-21T19:00:24Z,PT3M58S,11732361,146768,12098
HVDbwNBE8rQ,FORCÉ D'AVORTER UN HOMME ! - South Park: The Stick of Truth,2014-03-19T17:24:54Z,PT10M,7790775,82579,3514
KOA_A1A1vi0,CECI EST UN CRASH TEST /!\ - Turbo Dismount,2014-03-16T16:57:34Z,PT7M18S,8572977,94632,3640
zNO2xJhEgd0,COMMENT CHARCUTER UN MALADE ? - Surgeon Simulator (iPad version),2014-03-14T18:21:59Z,PT6M40S,5478784,54619,2275
MUhXGTNsIG4,L'ANARCHIE SUR UN TERRAIN DE FOOT ! - Goofball,2014-03-12T17:00:04Z,PT7M22S,7211193,80953,3987
UWaIU50qmkE,LE REGARD LE PLUS TERRIFIANT ! - Murder 2 (Garry's Mod),2014-03-09T17:12:35Z,PT7M53S,4700461,72074,3132
qV3LbcHpCNE,LE CHAMPS DE BATAILLE DU WTF ! - Plant vs Zombie,2014-03-07T17:00:08Z,PT6M47S,3863288,43270,1839
saKA51PHU_g,VOUS NE PASSEREZ PAS ! - Prop Hunt 2 (Garry's Mod),2014-03-05T17:06:42Z,PT9M18S,7665053,110790,4159
43f0QL2wOcs,IL FAUT QUE ÇA CESSE ! - Super Mario Bros 3 Remix,2014-03-02T17:29:42Z,PT7M36S,3496399,49909,2837
vJFAolr3kcA,SE GRATTER À TOUT PRIX ! - Happy Wheels 4,2014-02-28T19:45:56Z,PT6M29S,7600665,76002,3152
NUTlS8ym0d4,COMMENT BIEN ÉNERVER LES GENS ?! - Skate 3,2014-02-26T17:42:26Z,PT7M15S,8372867,101302,6431
dI97vWeDtik,SQUEEZIE PLAGIE PEWDIEPIE ?!,2014-02-23T19:24:56Z,PT6M31S,6373242,171110,14610
lPNqwFXHKzI,LE TIR À L'ARC DE L'EXTRÊME ! - Probably Archery,2014-02-21T18:14:38Z,PT7M26S,2909714,48015,2361
SAI4Z1Zou6E,MEURTRE À LA BANANE! - Question Time 8,2014-02-18T19:09:43Z,PT4M57S,12021581,173533,13803
f-MMcq4oOFw,"COMPILATION DES PIRES SIMULATEURS ! (Goat Pet, Sitting, Tree...)",2014-02-14T19:37:12Z,PT5M52S,3163151,50856,2023
dNf4v5Uklco,UN PETIT MASSAGE DES PIEDS ? - Happy Wheels 3,2014-02-12T18:09:18Z,PT6M18S,6001366,67489,3993
_4D5Dw2mm9c,AUREVOIR FLAPPY BIRD! (Flappy Bird & Fake),2014-02-10T18:04:06Z,PT7M48S,4771651,69529,9421
FuFfYyy4Ff0,ATTAQUÉS PAR UN OURS ! - Rust,2014-02-07T18:09:18Z,PT7M23S,3186212,46005,1930
fcSLWkpWAuw,BOB LE BRICOLEUR VS ZOMBIES - Dying Light,2014-02-05T19:03:06Z,PT7M20S,5142629,67741,2948
kF5pHeaVkXQ,UNE PIEUVRE DANS UNE ATTRACTION ! - Octodad: Dadliest Catch (2),2014-02-03T16:27:21Z,PT11M1S,4844517,65124,2736
5qqbgNEMMqA,LA PIEUVRE LA PLUS COOL - Octodad: Dadliest Catch (1),2014-01-31T19:04:17Z,PT8M5S,3639302,51320,2119
MuTTT7awE_E,LE PEDOBEAR DE LOS SANTOS ! - GTA V,2014-01-30T16:31:44Z,PT6M23S,8703217,106521,5151
fzSNmWP1uck,METTRE DES TOILETTES SUR SLENDER ! - Lost in a Forest,2014-01-26T18:18:43Z,PT5M25S,2045013,31479,5071
nXh2C9lBl6o,SI JE CASSAIS UN OBJET IMPORTANT ?! - Question Time 7,2014-01-24T18:51:34Z,PT3M37S,10570441,137398,17398
Daz09X_Ge-k,EN POSITION FŒTALE DANS UN CASIER ! (Best of Outlast),2014-01-22T17:29:31Z,PT9M51S,3031751,52778,3646
uNEwN5NkVqE,LA GUERRE DES LAPINS ! - Overgrowth,2014-01-19T18:59:52Z,PT7M15S,4362297,64009,2970
wmMJo1OIIAA,SE TOUCHER LES TÉTONS AVEC MILEY CYRUS ! - Happy Wheels 2,2014-01-17T17:34:47Z,PT6M42S,8094145,91797,3372
Wl1yI75tp9I,MONSIEUR LE PRÉSIDENT ! (Mr President),2014-01-15T16:54:15Z,PT5M40S,5718416,90109,3690
k1-jRzrqlFI,L'HOMME À LA FORCE TITANESQUE ! - Haunted Hell,2014-01-12T17:25:07Z,PT5M21S,2266889,34761,1698
CxL0wg4XRy0,SQUEEZIE VERSION FILLE ?! - Question Time 6,2014-01-10T17:16:45Z,PT3M20S,8655231,116182,23742
kU0ch9dezWA,LA MALÉDICTION DU SABRE ! - Happy Wheels,2014-01-08T17:37:49Z,PT7M38S,4951387,71982,4312
kHpvByoOXHo,FAIRE DU RODÉO SUR GOLLUM ! - A Mothers Inferno,2014-01-05T17:56:01Z,PT6M17S,2940089,38739,2308
BBUKDTxKKGk,JE LES AI TOUS TUÉ ! - Calm Time,2014-01-03T17:31:32Z,PT7M34S,3370877,43467,2713
IZny565TktI,L'ÉCOLE DE L'HORREUR ! (TERRIFIANTE) - Within Deep Sorrows,2014-01-01T18:29:31Z,PT7M43S,3338219,48126,5288
H_fKew6mZLo,LE PLUS MAUVAIS WORMS JAMAIS VU ! - Worms Reloaded,2013-12-29T16:30:50Z,PT8M23S,4884413,54418,2261
oH4qVtR4gEs,THIS IS SQUEEZIRTA ! (VIOLENCE EXTRÊME) - Chivalry: Medieval Warfare,2013-12-27T17:46:12Z,PT7M29S,3296915,43467,2627
zkxEWdKGD_8,LE SWEAT POSSÉDÉ ;_; - Vapour,2013-12-25T16:33:20Z,PT6M35S,1317727,22087,1458
6ifMGqQLtxc,LA MEILLEURE CACHETTE POSSIBLE ! - Prop Hunt (Garry's Mod),2013-12-22T17:18:01Z,PT9M32S,13913504,152603,7178
Vxx4otJAHoA,12 TRUCS CHIANTS DANS LE MÉTRO/RER,2013-12-20T16:30:54Z,PT2M57S,10502282,143626,5457
RmW7QhvI4dM,IL ME MANQUE UN TÉTON ! - Question Time 5,2013-12-17T17:10:19Z,PT3M23S,11226805,135620,12084
-1fuPPMfriw,L'HOMME AU CALEÇON SUR LA TÊTE - Lumber Island,2013-12-15T17:11:45Z,PT8M47S,1941663,39340,2595
qaoDaLoXlC4,COMMENT SE FAIRE EXPLOSER PAR RAMBO - Wrestling Revolution,2013-12-13T16:22:21Z,PT5M54S,2268139,34000,1462
vwJ3xnGaNeo,PARTY ROCK HARDCORE \m/ - HitOthers,2013-12-11T17:05:43Z,PT5M44S,1039984,28674,1017
2ybpSbpyrwA,SEUL À JAMAIS :'( - Murder (Garry's Mod),2013-12-09T16:30:01Z,PT11M40S,7235538,160802,11934
Fnjcs87481I,Bienvenue sur ma chaîne !,2013-12-08T16:27:55Z,PT35S,1033175,28259,1229
KuQWrNBnLtQ,LES 3 PIRES GOSSES DE LA PLANÈTE ! - Don't make me turn this car around,2013-12-04T16:14:56Z,PT6M10S,5924029,67098,3074
tPjiPuSlHL8,VICTIMISÉ EN PRISON ;_; - Hard Time,2013-12-01T17:05:59Z,PT7M11S,7215297,71391,3022
nC0c9Hv-Pd4,L'HORREUR PIXELISÉE ! - Light and Shadows,2013-11-29T17:31:52Z,PT6M36S,1885012,29113,2277
tqmRP2fdylA,J'AI FAIT UN PACTE AVEC UN DÉMON ! - Pact with a Demon,2013-11-27T15:56:54Z,PT6M53S,2684770,37620,2497
cUAtMGtUie8,SQUEEZIE - XBOX ONE & PS4,2013-11-24T17:15:52Z,PT3M58S,11767900,232796,30925
KsEMx2hR7NY,FOUTUS SCIENTIFIQUES ! - DeadLab,2013-11-22T17:47:10Z,PT5M28S,2436448,34141,1673
simTvKaAGBI,LE PIRE VOLEUR DE TOUS LES TEMPS - The Very Organized Thief,2013-11-19T17:40:14Z,PT7M56S,4566464,58463,3960
0JKZIYxK7hg,LE MYSTÈRE DE LA 3DS - Question Time 4,2013-11-17T16:37:14Z,PT4M2S,7125483,94463,6923
cX6Cn8Y_ixk,COMPILATION DE JEUX (VRAIMENT) POURRIS,2013-11-15T18:29:50Z,PT5M40S,5988002,66609,2488
FxeEuHDBOBI,ILS ONT TUÉ MON BÉBÉ :'( - Forgotten,2013-11-12T16:55:46Z,PT6M3S,2088766,31762,2448
3-BUYjf_QRY,VOUS NE SAVEZ PAS LA VÉRITÉ - Ampu-Tea,2013-11-10T17:43:49Z,PT7M7S,2685150,34956,1462
EzlqmQLzH5M,1 MILLION D'ABONNÉS,2013-11-08T16:40:14Z,PT11M28S,4290972,121276,7995
4_ruxka5n58,APPROUVÉ PAR LES AUTRUCHES ! - Ostrish Island,2013-11-06T16:30:01Z,PT9M38S,1720031,30278,2383
Vi29HMyM9ow,FIN DE LA PGW 2013 : MERCI À VOUS ! (Bonus),2013-11-04T17:08:07Z,PT1M14S,789489,21419,1362
XbNsjDSLTxc,ILS VISITENT UNE MAISON ÉTRANGE... (Bonus Halloween),2013-10-31T19:12:36Z,PT2M9S,904221,31207,3223
68IXxs-sZEE,SQUEEZIE - MES TRUCS DÉBILES,2013-10-29T14:59:17Z,PT3M48S,11187400,152459,10510
_n7uRpU3BKA,15M SEUL DANS LES BOIS :'( - The Screecher,2013-10-27T16:46:06Z,PT15M33S,1569228,34362,5522
FsOKWdbbBxM,LA FÊTE LA PLUS BIZARRE DU MONDE - The interesting tale of mister Duckfish,2013-10-25T15:37:18Z,PT5M41S,2190807,33717,3327
DFBw7A93etM,LE PLUS GROS ADDICT DE LA TÉLÉ ! - Bwak,2013-10-22T16:17:47Z,PT4M14S,2389498,34997,2338
Mh7O2WjtJJ4,SQUEEZIE PETIT ?! - Question Time 3,2013-10-18T15:30:01Z,PT3M44S,7034107,107463,14625
FjHtxtOpJrI,CETTE HORRIIIBLE ARAIGNÉE ! ;_; - Parasite,2013-10-15T15:25:43Z,PT5M24S,1576917,28971,2685
8hFdoLubCmI,JE VOUS OPÈRE ? NE CRAIGNEZ RIEN ! - Surgeon Simulator (space),2013-10-12T15:15:10Z,PT6M20S,5476715,57991,3161
Id9K_pQzz4g,LA FILLE LA PLUS BIZARRE DU MONDE ! - DreadOut,2013-10-09T15:31:43Z,PT9M16S,1676951,27220,2958
uLT3kXG402A,IMPOSSIBRUUU ! - Le jeu le plus dur du monde 2,2013-10-07T15:31:00Z,PT7M,5176466,53481,3471
Cj7OEiQgPW0,LE JEU D'HORREUR LE PLUS NUL ! - Jeff The Killer,2013-10-05T15:34:52Z,PT6M4S,2422364,39397,3786
bKFTM9tlEtI,QUAND ON S'EMMERDE AUX TOILETTES ._. - Toilet Simulator - WTFF.,2013-10-01T15:46:39Z,PT5M49S,4477176,85067,9335
KuYM1zdPw_I,FOUTU CLOWN PERVERS ! - Bewilder House,2013-09-28T16:35:22Z,PT5M21S,5224726,62198,4856
CcRaARPESWU,LA TAILLE DE MON PÉNIS ?! - Question Time 2,2013-09-26T15:55:37Z,PT3M4S,7464758,93464,5501
M1aOy1r2phY,LE JEU QUI T'EXPLOSE LA TÊTE ! - Hexagon,2013-09-20T15:32:07Z,PT6M52S,1853019,28933,4039
mfVGbfIcJzw,COMMENT AVOIR DES ABONNÉS ? - Question Time 1,2013-09-18T15:28:22Z,PT5M11S,5865747,120863,10260
h7JGmE_OcjI,JE DÉTESTE LES ENFANTS ! ;_; - Amnesia a Machine for Pigs (1),2013-09-17T16:17:49Z,PT18M56S,2171102,28435,3139
ARyMitSRGBU,"UN MOMENT DÉBILE AVEC SQUEEZIE #5 - TRUCS DE BG, TRUCS CHIANTS & BIGGEST TROLL EVER !",2013-09-13T16:10:36Z,PT6M30S,5073800,77268,3993
zw4ggeKWNRM,ÉPIC KUNG-FOOT ! - On affronte le créateur de Rayman et de la BO du jeu ! :D,2013-09-12T16:46:34Z,PT9M25S,1220863,26086,1314
98b5dsug5hs,OÙ SONT MES OS ?! - Ragdoll Olympics,2013-09-10T16:02:39Z,PT6M27S,2688912,37676,2623
hIxlLS1HX_o,16 MINUTES EN ASILE (horrible) ;_; - Blackwell Asylum,2013-09-07T18:22:25Z,PT16M24S,2408620,38969,4799
RtxB7N073p4,PAS LE TEMPS DE VOUS EXPLIQUER ! (No time to Explain),2013-09-05T16:53:58Z,PT5M30S,2301321,38684,2263
IvOdxIGHnSM,MR POULPE FRÔLE LA MORT ! :'( - Part 2,2013-09-02T16:09:46Z,PT6M1S,1533648,19722,1202
UkH5Sev_LJw,J'AI BESOIN D'UN PSYCHIATRE - Syobon Action 3,2013-08-30T15:00:17Z,PT6M21S,3479488,40972,3096
V_oLGu70T6A,L'HANDICAP POULPE :C - Part 1,2013-08-27T15:01:20Z,PT8M7S,2708406,33769,2781
p5ShtJa4dWA,ASSASSINÉ PAR UN LAPIN ! ;_;,2013-08-25T16:46:41Z,PT4M23S,1256357,24103,2148
LueOIAxQhBQ,LIVRAISON DE PIZZA AFFREUSE ! (Pizza Delivery 2),2013-08-20T15:00:31Z,PT8M44S,2139892,31801,3862
9PxrO9mUEBk,LA GUERRE DES PÉNIS ! (Space Phallus),2013-08-15T16:43:12Z,PT4M6S,1707307,28544,2882
EavsaGeTBCY,LIVRAISON DE PIZZA ! (Pizza Delivery),2013-08-13T15:16:17Z,PT8M24S,3703779,55760,4558
e07BHroaRPk,ATTENTION : TÊTE COUPÉE VOLANTE (horrible) - Eyes,2013-08-10T13:14:10Z,PT11M7S,3149167,52003,7595
rTx1qwCLm0c,"ADIEU, JE SUIS MORT. - UNFAIR MARIO 3 - SATANÉES FOUGÈRES",2013-08-06T15:13:13Z,PT10M20S,3148739,50146,5030
VHvDArusYgA,NOUS SOMMES DES AVENTURIERS ! - Kinect Adventures,2013-08-03T16:48:25Z,PT6M38S,1536253,24576,2617
2WvGsXZLjqk,MA PAGE FACEBOOK HACKÉE : ATTENTION !,2013-08-01T11:57:23Z,PT4M27S,944111,29372,3629
GWvOM02f7IQ,SQUEEZIE - TOP 5 DES PHRASES CHIANTES EN VACANCES,2013-07-30T14:59:12Z,PT5M21S,7519291,140608,8385
VJy3mS1vc24,JE SUIS UN JEDI ! - Star Wars Kinect,2013-07-26T08:30:12Z,PT3M45S,1821186,31127,1633
dE4wsRVeyz0,LE JEU DE VOITURE LE PLUS WTF - Crazi Taxi,2013-07-23T15:00:19Z,PT5M8S,2064938,30108,2183
1KHTs5rqmVw,JEU DE PÊCHE = MÉGA CHIANT - Sega Bass Fishing,2013-07-19T15:00:19Z,PT3M21S,1619375,28341,1800
9HabSx3rziw,LE PLUS GROS JEU DE PERVERS DU MONDE - Bikini Karate Babes 2,2013-07-16T15:00:24Z,PT13M29S,3276643,37789,2942
SsssJs6SlsY,SQUEEZIE - LES VACANCES,2013-07-12T14:30:21Z,PT4M8S,4547108,80054,4852
VlOhxV66wQE,J'ME SUIS FAIT TROLLER ;_; - Death Can Await partie 2 & Troll Story,2013-07-09T15:12:44Z,PT13M30S,1799653,22890,2330
WZsxFu4DWrc,MARIO VS PEACH - NOUS SOMMES DÉFORMÉS ! ;_;,2013-07-07T18:33:46Z,PT6M27S,2653294,31132,3198
T-ZueMmPVQ4,"ATTAQUÉ PAR DES HOMMES NUS - Amnesia : Death Can Await, partie 1",2013-07-04T15:49:13Z,PT21M48S,2696616,35000,5777
CGySMiskcZo,JE SUIS SANGOKU : IT'S OVER 9000 !!! - DBZ Kinect,2013-07-02T16:45:08Z,PT4M29S,2610721,33546,2535
xA3eiav_5sY,"UN MOMENT DÉBILE #4 - MYSTÈRE DU PQ, PIPI SUR UN JEU, ENCEINTE PORTATIVE, BAC !",2013-06-28T15:00:43Z,PT4M42S,3597919,53285,3982
kNifz3pD9vs,"HELL'S HOUSE - POUPÉE MALÉFIQUE, HOMME BLEU & ACTRICE HORS-NORME",2013-06-26T15:13:17Z,PT5M18S,1096408,20417,1786
oZvmVbk1scc,"LIPS : CHANTONS ! - Barbie SqueeZie, Kanye Zi & MC Lucas !",2013-06-24T16:48:32Z,PT1M48S,2335612,57767,6070
I9IHSeaSPC8,BALADE À DISNEYLAND - Le top pour se détendre des examens !,2013-06-19T15:56:35Z,PT5M36S,3665412,47008,3566
YVLz9p7WEiM,DEVIENS-JE FOU ?! - UNFAIR MARIO 2 - ON AURA SA PEAU !,2013-06-16T14:00:20Z,PT5M29S,1933889,36121,2673
BzPdKfTXexo,DISNEY PARTY - DANSER LIKE A BOSS SUR DU DISNEY 8-),2013-06-14T16:55:55Z,PT6M49S,1456976,23080,2895
w_2tzWxxXd4,500.000 ABONNÉS : UN GRAND MERCI !,2013-06-06T15:30:39Z,PT9M3S,822767,48354,6039
eRNdhbKB_X0,"UN MOMENT DÉBILE #3 - TRAVAIL, TOILETTES, PIANO, ANGES DU FPS",2013-05-31T16:54:11Z,PT5M21S,2713636,46966,2146
4WfFgr5i0zk,SQUEEZIE - SKYLANDERS,2013-05-28T15:22:59Z,PT3M58S,2010694,32634,2390
JZX2k2EDB9Q,SHARK ATTACK ! - Le Call of Duty : Ghosts des habitants de l'océan !,2013-05-22T15:51:11Z,PT6M56S,1869930,21344,1329
YxLYccD85Bk,TOY STORY SUR MINECRAFT - On est des jouets avec Frigiel ! - Épisode 2,2013-05-17T16:20:09Z,PT27M10S,2748086,33403,3553
oso7pTNeGks,"UN MOMENT DÉBILE #2 - PIPI, ÊTRE DJ, BOXE ET PARC D'ATTRACTION !",2013-05-15T15:50:27Z,PT4M53S,2271989,36714,2426
jQwGKqxm2xw,"DÉTENTE SUR METRO LAST LIGHT☻- Une nuke, des monstres, un métro - L'histoire du jeu & gameplay !",2013-05-14T15:00:54Z,PT21M50S,583116,13478,1060
Zx6417IBIog,TOY STORY SUR MINECRAFT - On est des jouets avec Frigiel ! - Épisode 1,2013-05-11T16:10:37Z,PT28M14S,5472948,60629,5271
bpyKDH-PHL4,ATTAQUÉS PAR LA COPINE DE SLENDER ;_; - Ce vieux rat - Slender is back ép 2,2013-05-09T15:09:46Z,PT11M58S,1501452,23655,3609
ypl7L5Sb0vQ,JE SUIS PSYCHOLOGIQUEMENT MORT - Cat Mario - Episode 2,2013-05-05T14:47:54Z,PT9M52S,2374328,32842,3403
EGJ8aSmn2nI,Les défis de SqueeZie | Episode 1 : MOTO TARTE (périmées) | LE RETOUR !,2013-05-03T15:00:39Z,PT7M17S,1098835,33729,2733
SN8PrJ_8LSw,LE RETOUR DES DÉFIS DE SQUEEZIE - TRAILER,2013-05-01T17:34:20Z,PT1M6S,207775,9767,1080
DYPGhPqpAxA,UN MOMENT DÉBILE AVEC SQUEEZIE #1,2013-04-29T15:14:50Z,PT5M41S,2296607,54326,9152
4psJoi0pMFA,LE JEU QUI VOUS TUERA - Cat Mario ;_;,2013-04-26T17:27:52Z,PT8M11S,2787828,38268,4999
H_qCaAP2nPQ,UN CLAVIER EN MOINS UN ! - UNFAIR MARIO - Les gamers & le soleil !,2013-04-23T15:11:20Z,PT7M6S,3198372,45588,4953
vL6kOPKEDy4,LES SUPER-HEROS DU FUTUR - On teste Injustice ! :D,2013-04-20T12:34:36Z,PT20M30S,3277825,39762,3412
1WQhFKT55sI,LE JEU LE PLUS DUR AU MONDE - La rage à son extrême,2013-04-17T15:22:24Z,PT9M3S,5530794,68992,7488
9c3izpvVIFM,Sumotori Dreams Mods - 0mfG kom cé ÉPIC ! | On a joué dans des chiottes !,2013-04-13T16:52:34Z,PT9M14S,3903742,49078,3862
V2OScftR3zU,SLENDER IS BACK - ON A ENFIN OWNED SLENDER OMFGGG !!!! - Episode 1,2013-04-11T20:05:25Z,PT25M6S,1796737,35499,2120
W905eVUrc3Y,Tomb Raider - Lara is BACK | On s'la joue chimpanzé | Episode 8,2013-04-09T15:11:48Z,PT33M41S,817623,15868,3608
Rc5pXIVd4t0,MINECRAFT'LAND : Le parc d'attraction le plus fun AU MONDE ! - Partie 2,2013-04-07T14:10:35Z,PT17M29S,3130453,63414,4367
mQE7zg7mqDI,MINECRAFT'LAND : Le parc d'attraction le plus fun AU MONDE ! - Partie 1,2013-04-05T15:34:44Z,PT16M51S,6423001,80645,5425
93pq9lRFH5c,Le FPS le MIEUX noté de l'année : Bioshock Infinite ! (Settings Ultra) (Détente),2013-04-03T17:06:37Z,PT22M8S,1110866,14824,1653
w2-4Q_FKuGI,J'ARRÊTE YOUTUBE,2013-04-01T14:49:47Z,PT1M44S,5107791,71164,4619
rLZI_IuoV3E,MA CONFIG ! [Résultats concours dans la description],2013-03-29T16:23:20Z,PT9M52S,828977,26876,3354
B7riunvH53o,Tomb Raider - C'EST LA GUERRE ! | Lara je t'appelle Zeus | Episode 7,2013-03-27T16:18:11Z,PT41M38S,722459,13505,2099
TcwMGJvaf0o,KAMIKAZE - Comment se taper des barres sur BF3 ?,2013-03-27T12:09:41Z,PT17M20S,1295704,20861,1720
y91K5hhvjBA,"Trials PC - Les studios, le jeu, et interview ! | Episode 2",2013-03-22T16:01:49Z,PT7M16S,429088,12923,797
SE62VvFC60c,RESULTATS CONCOURS ET... SURPRISE !,2013-03-20T19:02:10Z,PT3M7S,551908,11940,700
cU2fKP5_sac,Tomb Raider - Sauvons nos amis | L'épisode en Facecom ! | Episode 6,2013-03-20T17:11:29Z,PT32M20S,670217,11622,1199
EhGB4uccq_g,La musique rend FOU :') - La classe HUSS sur Black Ops 2 - Parlons de tout et de rien !,2013-03-19T15:54:20Z,PT14M14S,1998877,31824,3299
Gdm4vrDj4f8,Tomb Raider - A la rescousse de naufragés | CE SONT DES GARDIENS MOCHES QUI PUENT ;_; | Episode 5,2013-03-14T17:08:02Z,PT40M58S,791660,10836,1022
SVujcrAXYGs,Tomb Raider - On est pas au bout de nos surprises ! | ATTAQUÉE PAR DES YÉTIS ;_; | Episode 4,2013-03-14T15:00:50Z,PT33M53S,853913,12150,1361
Bb2-ZnBnOFs,Trials PC - Mon départ pour la finlande ! | Episode 1,2013-03-13T15:49:18Z,PT6M22S,1107919,22561,2034
ZQ3FJMf5TUA,Gagne ta console et le nouveau boîtier Avermedia ! - Concours 300.000 abonnés !,2013-03-10T16:10:52Z,PT3M51S,153169,10352,3590
EBIZkK091uk,"Tomb Raider - SOS ! | Lara Croft est un soldat, c'est SÛR ! | Episode 3",2013-03-09T15:32:39Z,PT40M43S,863523,13588,1573
wT45zt8mjGU,WORLD BIGGEST WAZA EVER ! (Wassup) - Spécial 300.000 !,2013-03-07T16:12:03Z,PT4M44S,846703,25262,2474
ug2W6LpIbfw,"Tomb Raider - Une embuscade pimentée ! | Cette fois, nous sommes presque seul... | Episode 2",2013-03-06T15:20:49Z,PT49M3S,1175207,23057,2578
uz07Ndv0CyM,Tomb Raider - Le début d'une incroyable aventure ! | A la recherche de nos alliés | Episode 1,2013-03-05T18:02:48Z,PT33M10S,2251180,34835,3766
rygY7w9uU4w,LA GUITARE - LES LOLZ ! (Bêtisier),2013-03-05T16:31:20Z,PT4M51S,203267,5900,337
R8nMcN_TdPs,Tomb Raider 2013 : L'aventure commence demain !,2013-03-04T15:43:13Z,PT1M25S,110686,4013,589
a6geDWRNW9U,300.000 ABONNÉS WAZAAAAAAAAAA,2013-03-02T20:51:35Z,PT2M30S,5944581,192047,19444
_HxuSP3BJzk,SQUEEZIE - LA GUITARE,2013-03-01T19:19:01Z,PT5M54S,1938961,38170,3144
iuaKv_beQko,ENORME FRAYEUR SUR DEAD SPACE 3 OMFG - 3ème vidéo dé.. Stressante !,2013-02-23T18:34:17Z,PT15M42S,423495,6180,843
N4-RH6xZnC8,Tekken - Combat en équipe avec UNE GEEK de Tekken ! - Le cri le plus strident du monde ;_;,2013-02-23T15:32:21Z,PT25M47S,1205745,12509,1156
WU8VsAr5Hko,Naruto [UNSG] - L'histoire de KAKASHLU :D ! - 1ère vidéo détente,2013-02-23T14:01:04Z,PT19M5S,2139402,41882,5050
DgnELGX-q6g,LE SAMEDI DÉTENTE ! :),2013-02-23T14:00:09Z,PT1M49S,208403,8455,400
xzEPq9oOsNs,ILLUSION - LE HOBBIT PERVERS ! T.T,2013-02-22T19:38:26Z,PT6M23S,865421,13534,1888
i1BB19Mx9_U,ONE DIRECTION & JUSTIN BIEBER ;_; - Just Dance 4 en mode hater !,2013-02-20T16:19:49Z,PT10M10S,730414,15809,3831
